JOURNAL_TITLE,JOURNAL_SUBJECTS
Jurnal Pendidikan IPA Indonesia,EducationdInternational Journal of Evaluation and Research in Education (IJERE),EducationdQIJIS,"Religion, Education"dSAINS TANAH - Journal of Soil Science and Agroclimatology,EducationdPARAMUROBI,EducationdBiosfer: Jurnal Pendidikan Biologi,EducationdTadris: Jurnal keguruan dan Ilmu Tarbiyah,EducationdJurnal Ilmu Pendidikan,EducationdJURNAL ILMIAH PENDIDIKAN FISIKA AL-BIRUNI,"Earth & Planetary Sciences, Education, Electrical & Electronics Engineering, Physics"dInternational Journal on Emerging Mathematics Education,EducationdScientific Dental Journal,"Biochemistry, Genetics & Molecular Biology, Dentistry, Education, Health Professions, Immunology & microbiology"dJurnal Pendidikan dan Kebudayaan,EducationdJournal of Research and Advances in Mathematics Education,"Education, Mathematics"dAl-Jabar : Jurnal Pendidikan Matematika,"Education, Mathematics"dJURNAL PENDIDIKAN USIA DINI,EducationdJEELS,"Education, Languange, Linguistic, Communication & Media"dJurnal Infinity,EducationdRegister Journal,"Education, Languange, Linguistic, Communication & Media"dJurnal Riset Pendidikan Matematika,"Decision Sciences, Operations Research & Management , Education, Mathematics"dInternational Journal of Education,"Arts, Humanities, Education, Languange, Linguistic, Communication & Media, Mathematics, Physics, Social Sciences"dPRofesi Humas : Jurnal Ilmiah Ilmu Hubungan Masyarakat,"Education, Languange, Linguistic, Communication & Media, Social Sciences"dJurnal Kajian Bimbingan dan Konseling,"Arts, Humanities, Education, Public Health, Social Sciences"dJournal of Education and Learning,"Economics, Econometrics & Finance, Education, Languange, Linguistic, Communication & Media, Mathematics, Social Sciences"dJurnal Penelitian & Pengembangan Pendidikan Fisika,"Education, Physics"dJURNAL BIOEDUKATIKA,EducationdJurnal Ilmiah Peuradeun,"Religion, Humanities, Education, Law, Crime, Criminology & Criminal Justice, Social Sciences"dPsikohumaniora: Jurnal Penelitian Psikologi,"Education, Public Health, Social Sciences, Other"dJurnal Edukasi dan Penelitian Informatika (JEPIN),"Computer Science & IT, Education"dBeta: Jurnal Tadris Matematika,"Education, Social Sciences"dJurnal Kawistara,EducationdJournal of Educational Science and Technology,"Education, Engineering"dAssets: Jurnal Akuntansi dan Pendidikan,"Economics, Econometrics & Finance, Education, Social Sciences"dJournal of English Educators Society,"Education, Languange, Linguistic, Communication & Media"dJurnal Iktiologi Indonesia,"Agriculture, Biological Sciences & Forestry, Education, Public Health"d"Jurnal Pendidikan: Teori, Penelitian, dan Pengembangan",EducationdEDUKASI: Jurnal Penelitian Pendidikan Agama dan Keagamaan,EducationdJurnal Inovasi Pendidikan IPA,"Agriculture, Biological Sciences & Forestry, Education, Mathematics"dJurnal Pendidikan Fisika Indonesia,"Education, Physics"dJurnal Penelitian dan Pembelajaran IPA,EducationdJurnal SPORTIF : Jurnal Penelitian Pembelajaran,EducationdEnglish Review: Journal of English Education,"Arts, Humanities, Education, Languange, Linguistic, Communication & Media"dEralingua : Jurnal Pendidikan Bahasa Asing dan Sastra,"Arts, Humanities, Education, Languange, Linguistic, Communication & Media"dCOUNS-EDU: The International Journal of Counseling and Education,EducationdSawwa Jurnal Studi Gender,EducationdDUNAMIS: Jurnal Teologi dan Pendidikan Kristiani,"Religion, Education, Social Sciences, Other"dAl Ibtida: Jurnal Pendidikan Guru MI,EducationdJurnal Kebijakan dan Administrasi Publik,"Decision Sciences, Operations Research & Management , Education, Public Health, Social Sciences"dStudies in English Language and Education,"Education, Languange, Linguistic, Communication & Media"dISLAMICA: Jurnal Studi Keislaman,"Religion, Education"dJurnal Tadris Kimiya,"Chemistry, Education"dJurnal Pendidikan Islam,EducationdBiosaintifika: Journal of Biology & Biology Education,"Agriculture, Biological Sciences & Forestry"dEDUKASIA,EducationdREiD (Research and Evaluation in Education),EducationdJurnal Prima Edukasia,EducationdAl-Ta lim Journal,EducationdPsikis,EducationdInternational Journal of Computing Science and Applied Mathematics,"Computer Science & IT, Education, Mathematics"dJURNAL SELULOSA,EducationdKonselor,EducationdTadib,EducationdKwangsan: Jurnal Teknologi Pendidikan,"Education, Languange, Linguistic, Communication & Media"dLangkawi: Journal of The Association for Arabic and English,"Education, Languange, Linguistic, Communication & Media, Library & Information Science, Social Sciences"d"EDULITE: Journal of English Education, Literature and Culture",EducationdMAJALAH ILMIAH GLOBE,"Earth & Planetary Sciences, Education"dINFERENSI,"Economics, Econometrics & Finance, Education, Law, Crime, Criminology & Criminal Justice"dJurnal Pendidikan Agama Islam (Journal of Islamic Education Studies),"Arts, Humanities, Education, Social Sciences"dJASF (Journal of Accounting and Strategic Finance),"Economics, Econometrics & Finance, Education, Environmental Science, Social Sciences, Other"dFIKRAH,"Religion, Arts, Humanities, Education"dDinamika Ilmu,"Education, Languange, Linguistic, Communication & Media, Social Sciences"dPanggung,EducationdMADANIA: JURNAL KAJIAN KEISLAMAN,"Religion, Education"dJURNAL TEKNOLOGI PENDIDIKAN,"Computer Science & IT, Education"dArabi : Journal of Arabic Studies,"Education, Languange, Linguistic, Communication & Media"dJURNAL STANDARDISASI,EducationdBuletin Sumber Daya Geologi,"Education, Energy, Engineering, Environmental Science"dKafa`ah: Journal of Gender Studies,EducationdPerspektif : Review Penelitian Tanaman Industri,EducationdVeritas et Justitia,EducationdJurnal Al Bayan: Jurnal Jurusan Pendidikan Bahasa Arab,"Education, Languange, Linguistic, Communication & Media"dPenamas,"Education, Social Sciences"dJurnal Afkaruna,EducationdREKAM,EducationdJurnal Pendidikan Kedokteran Indonesia: The Indonesian Journal of Medical Education,"Health Professions, Medicine & Pharmacology, Public Health"dRELIGIA,"Religion, Humanities, Education"dTARBIYA (Journal of Education in Muslim Society),EducationdElkawnie,"Biochemistry, Genetics & Molecular Biology, Education, Engineering"dSociety,"Humanities, Education, Languange, Linguistic, Communication & Media, Law, Crime, Criminology & Criminal Justice, Social Sciences"dADDIN,"Religion, Arts, Humanities, Education"dJurnal Anestesi Perioperatif,EducationdJurnal Ilmu Pendidikan,EducationdTAWARIKH,"Arts, Humanities, Education, Languange, Linguistic, Communication & Media, Social Sciences"dPAROLE - Journal of Linguistics and Education,EducationdSMART,"Education, Social Sciences"dJurnal Pendidikan Islam,EducationdJurnal Al-Manahij,EducationdSAINTEK PERIKANAN,EducationdJurnal Pendidikan Indonesia,EducationdJurnal Pendidikan Matematika,"Education, Mathematics"dDinamika Pendidikan,EducationdREAKTOR,EducationdPSIKOPEDAGOGIA Jurnal Bimbingan dan Konseling,EducationdAl-Ulum,"Religion, Education"dJurnal Sains & Teknologi Modifikasi Cuaca,EducationdREINWARDTIA,EducationdJURNAL PENELITIAN,EducationdJurnal Filsafat,"Arts, Humanities, Education, Languange, Linguistic, Communication & Media, Social Sciences"dAKSIOMA JURNAL PENDIDIKAN MATEMATIKA,"Education, Mathematics"dTREUBIA,EducationdJurnal KALAM,"Religion, Education"dJurnal Wasian,EducationdPALASTREN,Educationd"Journal of Educational, Health and Community Psychology","Education, Public Health"dJurnal Geologi dan Sumberdaya Mineral,"Education, Energy, Engineering, Environmental Science"dJurnal Sains Dirgantara,EducationdJurnal Ilmiah Kursor,EducationdJurnal POETIKA,EducationdSHARE,EducationdAMERTA,"Arts, Humanities, Earth & Planetary Sciences, Education, Environmental Science, Other"dJurnal Penelitian Karet,"Agriculture, Biological Sciences & Forestry, Education"dTSAQAFAH,"Economics, Econometrics & Finance, Education, Law, Crime, Criminology & Criminal Justice, Social Sciences"dBIOEDUSCIENCE,"Agriculture, Biological Sciences & Forestry, Biochemistry, Genetics & Molecular Biology, Education"dJournal of Medives,"Education, Mathematics"dJNPM (Jurnal Nasional Pendidikan Matematika),"Education, Mathematics"dEdukasi Islami : Jurnal Pendidikan Islam,EducationdFormatif: Jurnal Ilmiah Pendidikan MIPA,EducationdJurnal Mosharafa,"Education, Mathematics"dJIPF (Jurnal Ilmu Pendidikan Fisika),"Education, Physics"dJurnal Pendidikan Fisika dan Keilmuan (JPFK),"Astronomy, Education, Physics"dJALIE: Journal of Applied Linguistics and Islamic Education,"Education, Languange, Linguistic, Communication & Media, Social Sciences"dKALAMATIKA Jurnal Pendidikan Matematika,"Education, Mathematics"dDesimal: Jurnal Matematika,"Education, Mathematics, Social Sciences"dScholaria: Jurnal Pendidikan dan Kebudayaan,"Education, Social Sciences"dSJME (Supremum Journal of Mathematics Education),"Education, Mathematics, Social Sciences"dMaPan : Jurnal Matematika dan Pembelajaran,"Education, Mathematics"dInternational Journal of Research in Counseling and Education,"Arts, Humanities, Decision Sciences, Operations Research & Management , Education, Languange, Linguistic, Communication & Media, Social Sciences"dJURNAL IQRA,EducationdJurnal Inspirasi Pendidikan,EducationdJurnal Semantik,"Education, Languange, Linguistic, Communication & Media"dJurnal Pendidikan (Teori dan Praktik),EducationdJurnal Sains dan Teknologi,"Computer Science & IT, Education"dCurricula : Journal of Teaching and Learning,EducationdPremiere Educandum: Jurnal Pendidikan Dasar dan Pembelajaran,EducationdMimbar Sekolah Dasar,EducationdJurnal Penjaminan Mutu,"Education, Social Sciences"dJIPM (Jurnal Ilmiah Pendidikan Matematika),EducationdREFLEKSI EDUKATIKA,EducationdSOSIO DIDAKTIKA,EducationdPolyglot: Jurnal Ilmiah,Education
Jurnal Bimbingan dan Konseling Terapan,"Education, Social Sciences"
Jurnal Riset dan Kajian Pendidikan Fisika,"Decision Sciences, Operations Research & Management , Education, Physics"
LLT Journal: A Journal on Language and Language Teaching,"Arts, Humanities, Education, Languange, Linguistic, Communication & Media, Social Sciences"
Teorema: Teori dan Riset Matematika,"Education, Mathematics"
Jurnal Pendidikan Edutama,Education
Journal of ICSAR,Education
Jurnal Analisa,Education
Jurnal Al-Tadzkiyyah,Education
JUPIIS: Jurnal Pendidikan Ilmu-ilmu Sosial,"Education, Social Sciences"
Jurnal Gantang,"Education, Mathematics"
Riau Journal of Empowerment,"Agriculture, Biological Sciences & Forestry, Economics, Econometrics & Finance, Education, Social Sciences"
Tadrib: Jurnal Pendidikan Agama Islam,"Education, Environmental Science, Library & Information Science, Mechanical Engineering, Social Sciences"
CogITo Smart Journal,"Computer Science & IT, Decision Sciences, Operations Research & Management , Education, Electrical & Electronics Engineering"
Indonesian EFL Journal,Education
PCD Journal,Education
Journal of Nonformal Education,Education
Edukasi,Education
Lentera Pendidikan,Education
IMPROVEMENT: Jurnal Ilmiah untuk peningkatan mutu manajemen pendidikan,"Decision Sciences, Operations Research & Management , Education"
Jurnal Penelitian Pendidikan IPA,"Agriculture, Biological Sciences & Forestry, Biochemistry, Genetics & Molecular Biology, Chemical Engineering, Chemistry & Bioengineering, Chemistry, Education, Materials Science & Nanotechnology, Physics"
Jurnal Inovasi Teknologi Pendidikan,Education
Jurnal Akuntabilitas Manajemen Pendidikan,Education
Journal EVALUASI,Education
Unnes Science Education Journal,Education
Jurnal Nasional Pendidikan Teknik Informatika (JANAPATI),"Computer Science & IT, Education, Engineering"
Ta'dibuna: Jurnal Pendidikan Islam,Education
Auladuna,Education
MANAGERIA: Jurnal Manajemen Pendidikan Islam,Education
JOMSIGN: Journal of Multicultural Studies in Guidance and Counseling,Education
Jurnal Pendidikan Ilmu Sosial,"Education, Social Sciences"
Jurnal Psikologi Pendidikan dan Konseling,"Education, Social Sciences"
International Journal of Pedagogy and Teacher Education,"Education, Social Sciences"
Briliant: Jurnal Riset dan Konseptual,"Civil Engineering, Building, Construction & Architecture, Computer Science & IT, Education"
VOLT : Jurnal Ilmiah Pendidikan Teknik Elektro,"Computer Science & IT, Control & Systems Engineering, Education, Electrical & Electronics Engineering, Engineering"
Nidhomul Haq: Jurnal Manajemen Pendidikan Islam,Education
"ETERNAL(english, teaching, learning, and Research Journal)","Education, Languange, Linguistic, Communication & Media"
Prisma Sains : Jurnal Pengkajian Ilmu dan Pembelajaran Matematika dan IPA IKIP Mataram,"Education, Social Sciences"
ALQALAM,"Arts, Humanities, Education, Social Sciences"
FIKROTUNA,Education
Journal of Health Education,"Education, Health Professions"
UNIFIKASI,Education
Journal of Physical Education Health and Sport,"Education, Health Professions"
Islamic Communication Journal,Education
Jurnal Pendidikan Geografi,"Earth & Planetary Sciences, Education"
Jurnal Ilmiah Al-Syir'ah,"Education, Languange, Linguistic, Communication & Media, Law, Crime, Criminology & Criminal Justice"
Pedagogia,Education
JURNAL PENDIDIKAN FISIKA,"Education, Physics"
Harmoni,Education
JURNAL PENDIDIKAN JASMANI DAN OLAHRAGA,"Education, Public Health"
IZDIHAR,"Education, Languange, Linguistic, Communication & Media"
FIBONACCI: Jurnal Pendidikan Matematika dan Matematika,"Education, Mathematics"
AL-ATHFAL : JURNAL PENDIDIKAN ANAK,Education
Journal of Natural Science and Integration,"Biochemistry, Genetics & Molecular Biology, Chemical Engineering, Chemistry & Bioengineering, Education"
Al-Hikmah: Jurnal Agama dan Ilmu Pengetahuan,"Economics, Econometrics & Finance, Education, Languange, Linguistic, Communication & Media, Other"
Jurnal Ilmiah Didaktika,Education
EDUHUMANIORA: Jurnal Pendidikan Dasar,"Arts, Humanities, Education"
EduChemia (Jurnal Kimia dan Pendidikan),"Chemical Engineering, Chemistry & Bioengineering, Chemistry, Education"
Profesi Pendidikan Dasar,Education
Jurnal Inovasi Pembelajaran (JINoP),Education
ELSE (Elementary School Education Journal) : Jurnal Pendidikan dan Pembelajaran Sekolah Dasar,"Education, Mathematics, Social Sciences"
Research Journal of Life Science,Education
Cakrawala: Jurnal Studi Islam,"Religion, Education"
Indonesian Journal of Informatics Education,"Computer Science & IT, Control & Systems Engineering, Education, Electrical & Electronics Engineering, Industrial & Manufacturing Engineering"
Edcomtech Jurnal Kajian Teknologi Pendidikan,"Arts, Humanities, Education, Social Sciences"
Journal of English Language Teaching and Linguistics,Education
Jurnal Akademika Kimia,"Chemistry, Education"
Sekolah Dasar: Kajian Teori dan Praktik Pendidikan,Education
"Sumatra Journal of Disaster, Geography and Geography Education",Education
DIDAKTIKA TAUHIDI: JURNAL PENDIDIKAN GURU SEKOLAH DASAR,"Education, Neuroscience, Social Sciences"
Elementary: Jurnal Ilmiah Pendidikan Dasar,Education
JBKI (Jurnal Bimbingan Konseling Indonesia),Education
Jurnal Manajemen & Supervisi Pendidikan,"Decision Sciences, Operations Research & Management , Education"
ENGAGEMENT : Jurnal Pengabdian Kepada Masyarakat,"Religion, Arts, Humanities, Education, Social Sciences, Other"
INTEK: Jurnal Penelitian,Education
Indonesian Journal of Guidance and Counseling: Theory and Application,"Education, Social Sciences, Other"
Jurnal VISI PPTK-PAUDNI,Education
Indonesian Journal of Science and Education,"Chemistry, Education, Environmental Science, Physics"
Jurnal Fourier,"Computer Science & IT, Economics, Econometrics & Finance, Education, Mathematics"
IJISH (International Journal of Islamic Studies and Humanities),"Religion, Humanities, Education, Languange, Linguistic, Communication & Media, Law, Crime, Criminology & Criminal Justice"
Al-MARSHAD: Jurnal Astronomi Islam dan Ilmu-Ilmu Berkaitan,"Astronomy, Education"
Math Didactic: Jurnal Pendidikan Matematika,Education
Jurnal Fisika FLUX,"Earth & Planetary Sciences, Education, Materials Science & Nanotechnology, Physics"
Jurnal Pendidikan Bisnis dan Manajemen,"Economics, Econometrics & Finance, Education"
Indonesian Language Education and Literature,"Arts, Humanities, Education, Languange, Linguistic, Communication & Media, Social Sciences"
Ethical Lingua: Journal of Language Teaching and Literature,"Education, Languange, Linguistic, Communication & Media"
MIMBAR PENDIDIKAN,Education
Anterior Jurnal,"Agriculture, Biological Sciences & Forestry, Civil Engineering, Building, Construction & Architecture, Education, Medicine & Pharmacology, Social Sciences"
Jurnal Penelitian dan Pengembangan Pendidikan Luar Biasa,Education
Biota,"Agriculture, Biological Sciences & Forestry, Biochemistry, Genetics & Molecular Biology, Education, Environmental Science, Medicine & Pharmacology"
AL-ASASIYYA: Journal Of Basic Education,"Arts, Humanities, Languange, Linguistic, Communication & Media"
Telematika,Education
EMARA Indonesian Journal of Architecture,"Civil Engineering, Building, Construction & Architecture, Education"
Murobbi: Jurnal Ilmu Pendidikan,Education
FITRAH:Jurnal Kajian Ilmu-ilmu Keislaman,"Religion, Education, Social Sciences"
Getsempena English Education Journal,Education
MUDARRISA Indonesian Journal of Islamic Education Studies,"Education, Social Sciences"
ISLAMUNA: Jurnal Studi Islam,Education
Lingua Didaktika: Jurnal Bahasa dan Pembelajaran Bahasa,"Education, Languange, Linguistic, Communication & Media"
Jurnal Sejarah dan Budaya,"Education, Social Sciences"
JURNAL DIVERSITA,"Education, Neuroscience, Social Sciences"
Cakrawala Dini: Jurnal Pendidikan Anak Usia Dini,Education
AL QUDS : Jurnal Studi Alquran dan Hadis,"Religion, Arts, Humanities, Education"
NUANSA: Jurnal Penelitian Ilmu Sosial dan Keagamaan Islam,"Economics, Econometrics & Finance, Education, Languange, Linguistic, Communication & Media, Law, Crime, Criminology & Criminal Justice, Social Sciences"
Jurnal Ekonomi Kesehatan Indonesia,"Education, Environmental Science, Health Professions, Public Health"
AGASTYA: JURNAL SEJARAH DAN PEMBELAJARANNYA,"Arts, Humanities, Education, Social Sciences"
Teknologi Kejuruan,"Education, Engineering"
JURNAL KONSELING GUSJIGANG,"Education, Social Sciences"
Scientiae Educatia,Education
Journal of Dedicators Community,"Arts, Humanities, Education, Public Health, Social Sciences"
Jurnal Moral Kemasyarakatan,"Education, Social Sciences"
Al Mahara: Jurnal Pendidikan Bahasa Arab,"Education, Languange, Linguistic, Communication & Media"
Jurnal Inovasi Pendidikan Dasar,Education
Journal of Biology Education,"Biochemistry, Genetics & Molecular Biology, Education"
Ijtima'iyya: Journal of Muslim Society Research,"Arts, Humanities, Economics, Econometrics & Finance, Education, Law, Crime, Criminology & Criminal Justice, Social Sciences"
BAREKENG: JURNAL ILMU MATEMATIKA DAN TERAPAN,"Computer Science & IT, Decision Sciences, Operations Research & Management , Education, Engineering, Mathematics"
Kelola: Jurnal Manajemen Pendidikan,Education
Jurnal Visipena,Education
RechtIdee,Education
Logic : Jurnal Rancang Bangun dan Teknologi,"Computer Science & IT, Education"
JURNAL ECONOMICA : Research of Economic And Economic Education,"Economics, Econometrics & Finance, Education"
Jurnal Penelitian Ekosistem Dipterokarpa,"Earth & Planetary Sciences, Education"
Perspektif,Education
Veritas : Jurnal Teologi dan Pelayanan,"Religion, Humanities, Education"
AT-TURAS: Jurnal Studi Keislaman,"Arts, Humanities, Economics, Econometrics & Finance, Education, Law, Crime, Criminology & Criminal Justice, Social Sciences"
AT TADIB,"Religion, Arts, Humanities, Education, Languange, Linguistic, Communication & Media, Social Sciences"
Jurnal Pendidikan Sains | Pendidikan Kimia,"Chemistry, Education"
Gontor AGROTECH Science Journal,"Agriculture, Biological Sciences & Forestry, Education"
JURNAL PENELITIAN,"Religion, Education"
LingTera,"Education, Languange, Linguistic, Communication & Media"
Akademika Jurnal Teknologi Pendidikan,"Computer Science & IT, Education"
SISFORMA,Education
Jurnal Pendidikan Fisika,"Education, Physics"
Jurnal Geosaintek,"Earth & Planetary Sciences, Education"
UPEJ   Unnes Physics Education Journal,"Education, Physics"
Jurnal Manajemen Teori dan Terapan,"Decision Sciences, Operations Research & Management , Education"
TADRIS: Jurnal Pendidikan Islam,Education
Jurnal Inovasi Pendidikan Kimia,"Chemical Engineering, Chemistry & Bioengineering, Chemistry, Education"
MEDIA KONSERVASI,"Earth & Planetary Sciences, Education"
Lembaran Ilmu Kependidikan,Education
JUTI: Jurnal Ilmiah Teknologi Informasi,"Computer Science & IT, Dentistry, Education, Library & Information Science"
Indonesian Journal of Early Childhood Education Studies,Education
JURNAL EKONOMI PENDIDIKAN DAN KEWIRAUSAHAAN,"Economics, Econometrics & Finance, Education, Social Sciences"
Euclid Jurnal Pendidikan Matematika,"Economics, Econometrics & Finance, Education, Mathematics, Social Sciences"
Journal of Innovative Science Education,Education
"GUIDENA: Jurnal Ilmu Pendidikan, Psikologi, Bimbingan dan Konseling","Education, Social Sciences"
SEPA: Jurnal Sosial Ekonomi Pertanian dan Agribisnis,Education
Sosial Budaya,"Education, Social Sciences"
"ACTIVE: Journal of Physical Education, Sport, Health and Recreation","Education, Public Health"
BIOMA,"Agriculture, Biological Sciences & Forestry, Education"
Hisbah: Jurnal Bimbingan Konseling dan Dakwah Islam,"Religion, Education, Social Sciences"
MAJALAH BIAM,Education
Potensia,Education
Al-Khwarizmi: Jurnal Pendidikan Matematika dan Ilmu Pengetahuan Alam,"Education, Mathematics"
DIDAKTIKA RELIGIA,"Education, Social Sciences"
Innovative Journal of Curriculum and Educational Technology,"Computer Science & IT, Education"
LENSA,Education
Jurnal Sains Dasar,Education
Phenomenon : Jurnal Pendidikan MIPA,"Chemistry, Education, Mathematics, Physics"
"JETL (Journal Of Education, Teaching and Learning)","Aerospace Engineering, Education, Social Sciences"
Ar-Raniry,"Religion, Education"
PAX HUMANA,"Arts, Humanities, Education, Languange, Linguistic, Communication & Media, Social Sciences, Other"
AWLADY Jurnal Pendidikan Anak,Education
Rechtsidee,Education
Indonesian Journal of Curriculum and Educational Technology Studies,"Computer Science & IT, Education"
Tarbiyatuna,"Religion, Arts, Humanities, Education, Social Sciences, Other"
Halaqa: Islamic Education Journal,Education
Sainteknol,Education
SEJ (Science Education Journal),Education
Jurnal MUDARRISUNA: Media Kajian Pendidikan Agama Islam,Education
Jurnal Ilmiah Pendidikan Lingkungan dan Pembangunan,"Education, Environmental Science"
Lisanu Ad-Dhod,"Religion, Education"
AL-ISHLAH: Jurnal Pendidikan,"Education, Languange, Linguistic, Communication & Media, Social Sciences"
Reflektika,"Religion, Education"
Performance,Education
The Journal of Educational Development,Education
Jurnal Pemberdayaan Masyarakat Madani (JPMM),"Arts, Humanities, Economics, Econometrics & Finance, Education, Social Sciences, Other"
Al-Bidayah: Jurnal Pendidikan Dasar Islam,"Education, Languange, Linguistic, Communication & Media, Neuroscience, Social Sciences, Other"
Jurnal Keuangan dan Bisnis,"Economics, Econometrics & Finance, Education"
Muallimuna : Jurnal Madrasah Ibtidaiyah,Education
JPPI (Jurnal Penelitian Pendidikan Indonesia),Education
Inspiratif Pendidikan,"Education, Social Sciences"
Science and Physics Education Journal (SPEJ),Education
Jurnal Cendekia : Jurnal Pendidikan Matematika,"Education, Mathematics"
Natural: Jurnal Ilmiah Pendidikan IPA,Education
Jurnal Pendidikan Sekolah Dasar,Education
Jurnal Ilmiah Setrum,Education
JOURNAL OF EDUCATIONAL SCIENCES,Education
Jurnal Numeracy,"Education, Mathematics"
AL-HAYAT,"Education, Social Sciences"
Empowerment,Education
JURNAL FOKUS KONSELING,"Education, Social Sciences"
"JMKSP (Jurnal Manajemen, Kepemimpinan, dan Supervisi Pendidikan)","Education, Social Sciences"
Bioedukasi: Jurnal Pendidikan Biologi,"Agriculture, Biological Sciences & Forestry, Biochemistry, Genetics & Molecular Biology, Education, Immunology & microbiology"
WACANA AKADEMIKA: Majalah Ilmiah Kependidikan,Education
Jurnal Mercumatika : Jurnal Penelitian Matematika dan Pendidikan Matematika,"Education, Mathematics"
Jurnal Kesehatan Vokasional,"Computer Science & IT, Education, Health Professions, Nursing, Public Health"
AKSIOMA,"Education, Mathematics"
Suska Journal of Mathematics Education,"Education, Mathematics"
Tarbawi : Jurnal Ilmu Pendidikan,Education
"ELINVO (Electronics, Informatics, and Vocational Education)","Computer Science & IT, Education, Electrical & Electronics Engineering"
Edumatika : Jurnal Riset Pendidikan Matematika,Education
PEDAGOGIK : JURNAL PENDIDIKAN,Education
IJoLE: International Journal of Language Education,"Arts, Humanities, Education, Languange, Linguistic, Communication & Media, Social Sciences"
Tunas Siliwangi : Jurnal Program Studi Pendidikan Guru PAUD STKIP Siliwangi Bandung,Education
Islamic Management: Jurnal Manajemen Pendidikan Islam,Education
EDUMATICA | Journal Pendidikan Matematika,"Education, Mathematics"
Edumatsains,"Agriculture, Biological Sciences & Forestry, Chemistry, Education, Mathematics, Physics"
BIOMA,"Agriculture, Biological Sciences & Forestry, Education"
Jurnal Zarah,"Chemistry, Education"
Gelanggang Olahraga: Jurnal Pendidikan Jasmani dan Olahraga (JPJO),Education
EDUDEENA: JOURNAL OF ISLAMIC RELIGIOUS EDUCATION,"Religion, Humanities, Education"
Jurnal Biotek,"Agriculture, Biological Sciences & Forestry, Biochemistry, Genetics & Molecular Biology, Education"
JIEET (Journal of Information Engineering and Educational Technology),"Computer Science & IT, Engineering"
Jurnal Elektro dan Telekomunikasi Terapan,"Computer Science & IT, Control & Systems Engineering, Education, Electrical & Electronics Engineering, Engineering"
DIDAKTIKA BIOLOGI: Jurnal Penelitian Pendidikan Biologi,Education
JOURNAL OF TEACHING AND LEARNING IN ELEMENTARY EDUCATION (JTLEE),Education
IJEE (Indonesian Journal of English Education),"Education, Languange, Linguistic, Communication & Media"
