JOURNAL_TITLE,JOURNAL_SUBJECTS
Jurnal Rekayasa Sipil,"Civil Engineering, Building, Construction & Architecture, Decision Sciences, Operations Research & Management , Engineering, Materials Science & Nanotechnology, Transportation"
Journal of Green Science and Technology,"Chemical Engineering, Chemistry & Bioengineering, Civil Engineering, Building, Construction & Architecture, Electrical & Electronics Engineering, Engineering, Industrial & Manufacturing Engineering"
TAPAK (Teknologi Aplikasi Konstruksi) : Jurnal Program Studi Teknik Sipil,"Civil Engineering, Building, Construction & Architecture, Control & Systems Engineering, Engineering, Mechanical Engineering, Transportation"
Jurnal Teknik Sipil dan Teknologi Konstruksi,"Civil Engineering, Building, Construction & Architecture, Engineering, Industrial & Manufacturing Engineering, Mechanical Engineering, Transportation"
BANGUN REKAPRIMA,"Humanities, Civil Engineering, Building, Construction & Architecture, Education, Engineering, Other"
"Jurnal Fokus Elektroda : Energi Listrik, Telekomunikasi, Komputer, Elektronika dan Kendali","Computer Science & IT, Control & Systems Engineering, Electrical & Electronics Engineering"
TESLA: Jurnal Teknik Elektro,"Electrical & Electronics Engineering, Engineering"
Jurnal Spektran,"Civil Engineering, Building, Construction & Architecture, Earth & Planetary Sciences, Social Sciences"
Jurnal Konstruksi,"Civil Engineering, Building, Construction & Architecture"
Network Engineering Research Operation [NERO],Computer Science & IT
J-ENSITEC,"Civil Engineering, Building, Construction & Architecture, Computer Science & IT, Industrial & Manufacturing Engineering, Mechanical Engineering"
"TELEKONTRAN: Jurnal Ilmiah Telekomunikasi, Kendali dan Elektronika Terapan","Computer Science & IT, Control & Systems Engineering"
TEKNOLOGI: Jurnal Ilmiah Sistem Informasi,"Computer Science & IT, Decision Sciences, Operations Research & Management , Electrical & Electronics Engineering, Engineering, Mathematics"
GANEC SWARA,"Agriculture, Biological Sciences & Forestry, Education, Engineering, Law, Crime, Criminology & Criminal Justice, Social Sciences"
Jurnal Ilmiah Flash,"Electrical & Electronics Engineering, Engineering"
POROS TEKNIK,"Chemical Engineering, Chemistry & Bioengineering, Civil Engineering, Building, Construction & Architecture, Earth & Planetary Sciences, Electrical & Electronics Engineering, Engineering"
Jurnal Ilmiah MITSU (Media Informasi Teknik Sipil Universitas Wiraraja),"Civil Engineering, Building, Construction & Architecture, Decision Sciences, Operations Research & Management , Engineering, Environmental Science, Transportation"
Information Management For Educators And Professionals (IMBI),"Computer Science & IT, Control & Systems Engineering, Decision Sciences, Operations Research & Management , Engineering, Other"
e-Jurnal Arus Elektro Indonesia,Electrical & Electronics Engineering
SAINTEKBU,"Computer Science & IT, Control & Systems Engineering, Library & Information Science"
Jurnal Teknovasi : Jurnal Teknik dan Inovasi,"Aerospace Engineering, Agriculture, Biological Sciences & Forestry, Computer Science & IT, Engineering, Industrial & Manufacturing Engineering, Materials Science & Nanotechnology"
Jurnal Manajemen Dirgantara,"Decision Sciences, Operations Research & Management , Education, Industrial & Manufacturing Engineering, Transportation"
Ecosystem,"Computer Science & IT, Electrical & Electronics Engineering, Engineering, Social Sciences"
Portal: Jurnal Teknik Sipil,"Civil Engineering, Building, Construction & Architecture"
Chemistry in Education,"Chemical Engineering, Chemistry & Bioengineering, Chemistry, Education"
Media Ilmiah Teknik Sipil,"Civil Engineering, Building, Construction & Architecture"
Jurnal Teknik,"Arts, Civil Engineering, Building, Construction & Architecture, Control & Systems Engineering, Electrical & Electronics Engineering"
Media Ilmiah Teknik Sipil,"Civil Engineering, Building, Construction & Architecture"
Jurnal Tekno,"Civil Engineering, Building, Construction & Architecture, Electrical & Electronics Engineering, Industrial & Manufacturing Engineering"
Jurnal Teknik,"Arts, Civil Engineering, Building, Construction & Architecture, Control & Systems Engineering, Electrical & Electronics Engineering"
Media Ilmiah Teknik Sipil,"Civil Engineering, Building, Construction & Architecture"
Jurnal Teknisia,Engineering
Jurnal Tekno,"Civil Engineering, Building, Construction & Architecture, Electrical & Electronics Engineering, Industrial & Manufacturing Engineering"
Media Ilmiah Teknik Sipil,"Civil Engineering, Building, Construction & Architecture"
INAQUE: Journal of Industrial & Quality Engineering,"Computer Science & IT, Economics, Econometrics & Finance, Engineering, Industrial & Manufacturing Engineering, Mechanical Engineering"
Bangunan,"Civil Engineering, Building, Construction & Architecture"
Jurnal Mantik Penusa,"Computer Science & IT, Control & Systems Engineering, Decision Sciences, Operations Research & Management"
Majalah Ilmiah UNIKOM,"Arts, Humanities, Computer Science & IT, Engineering, Law, Crime, Criminology & Criminal Justice, Social Sciences"
Journal of Mechanical Engineering and Mechatronics,"Energy, Materials Science & Nanotechnology, Mechanical Engineering, Transportation"
Jurnal Teknologi Informasi dan Komputer,"Computer Science & IT, Control & Systems Engineering, Economics, Econometrics & Finance, Education, Engineering, Social Sciences"
Edu Elektrika Journal,"Education, Electrical & Electronics Engineering"
Agroindustrial Technology Journal,"Agriculture, Biological Sciences & Forestry, Industrial & Manufacturing Engineering"
DINTEK,Engineering
JURNAL PENELITIAN DAN KAJIAN ILMIAH KESEHATAN POLITEKNIK MEDICA FARMA HUSADA MATARAM,"Arts, Humanities, Health Professions, Immunology & microbiology, Mechanical Engineering, Public Health"
INTEKNA,"Computer Science & IT, Economics, Econometrics & Finance, Electrical & Electronics Engineering, Other"
PSYCHOPEDIA : Jurnal Psikologi Universitas Buana Perjuangan Karawang,"Humanities, Decision Sciences, Operations Research & Management , Industrial & Manufacturing Engineering, Physics, Social Sciences"
SIPIL SAINS,"Civil Engineering, Building, Construction & Architecture"
INTEKNA,"Computer Science & IT, Economics, Econometrics & Finance, Electrical & Electronics Engineering, Other"
SIPIL SAINS,"Civil Engineering, Building, Construction & Architecture"
Journal of Mechanical Engineering Learning,Mechanical Engineering
Medical Journal of Indonesia,Medicine & Pharmacology
INDONESIAN JOURNAL OF PHARMACY,Medicine & Pharmacology
Jurnal Respirologi Indonesia,"Health Professions, Medicine & Pharmacology"
Indonesian Journal of Human Nutrition,Medicine & Pharmacology
BALI MEDICAL JOURNAL (BMJ),Medicine & Pharmacology
Indonesian Journal of Cancer Chemoprevention,"Biochemistry, Genetics & Molecular Biology, Medicine & Pharmacology"
Amerta Nutrition,"Health Professions, Medicine & Pharmacology, Nursing, Public Health, Other"
Paediatrica Indonesiana,"Health Professions, Medicine & Pharmacology"
Traditional Medicine Journal,"Health Professions, Medicine & Pharmacology, Public Health"
Industria: Jurnal Teknologi dan Manajemen Agroindustri,"Agriculture, Biological Sciences & Forestry, Biochemistry, Genetics & Molecular Biology, Chemical Engineering, Chemistry & Bioengineering, Control & Systems Engineering, Decision Sciences, Operations Research & Management , Economics, Econometrics & Finance, Engineering, Environmental Science, Industrial & Manufacturing Engineering, Materials Science & Nanotechnology, Medicine & Pharmacology, Other"
Indonesian Journal of Tropical and Infectious Disease,"Earth & Planetary Sciences, Health Professions, Medicine & Pharmacology, Public Health"
PHARMACIANA,Medicine & Pharmacology
Jurnal Fitopatologi Indonesia,Medicine & Pharmacology
Global Medical & Health Communication (GMHC),"Medicine & Pharmacology, Public Health"
Medical Laboratory Technology Journal,"Chemistry, Health Professions, Immunology & microbiology, Medicine & Pharmacology, Public Health"
Journal of Biomedicine and Translational Research,"Biochemistry, Genetics & Molecular Biology, Medicine & Pharmacology"
Journal of Dentistry Indonesia,"Dentistry, Medicine & Pharmacology"
Jurnal Sains Farmasi & Klinis,"Biochemistry, Genetics & Molecular Biology, Health Professions, Immunology & microbiology, Medicine & Pharmacology, Public Health"
Indonesian Journal of Pharmaceutical Science and Technology,"Computer Science & IT, Medicine & Pharmacology"
JURNAL MANAJEMEN DAN PELAYANAN FARMASI (Journal of Management and Pharmacy Practice),"Health Professions, Medicine & Pharmacology, Public Health"
Jurnal Pendidikan Kedokteran Indonesia: The Indonesian Journal of Medical Education,"Health Professions, Medicine & Pharmacology, Public Health"
Universa Medicina,"Health Professions, Immunology & microbiology, Medicine & Pharmacology, Public Health"
Jurnal Penyakit Dalam Indonesia,Medicine & Pharmacology
Oto Rhino Laryngologica Indonesiana,"Health Professions, Medicine & Pharmacology"
Journal of Pharmaceutical Sciences and Community,Medicine & Pharmacology
JKKI : Jurnal Kedokteran dan Kesehatan Indonesia,"Biochemistry, Genetics & Molecular Biology, Immunology & microbiology, Medicine & Pharmacology, Public Health"
Jurnal Anestesiologi Indonesia,"Health Professions, Medicine & Pharmacology, Public Health"
Pharmaceutical Sciences and Research (PSR),Medicine & Pharmacology
JURNAL ILMU KEFARMASIAN INDONESIA,Medicine & Pharmacology
"The Indonesian Journal of Gastroenterology, Hepatology, and Digestive Endoscopy","Health Professions, Medicine & Pharmacology"
ANNALES BOGORIENSES,"Agriculture, Biological Sciences & Forestry, Biochemistry, Genetics & Molecular Biology, Chemical Engineering, Chemistry & Bioengineering, Chemistry, Immunology & microbiology, Medicine & Pharmacology"
INDONESIAN JOURNAL OF BIOMEDICAL SCIENCES,Medicine & Pharmacology
Berkala Ilmu Kedokteran,Medicine & Pharmacology
Padjadjaran Journal of Dentistry,"Biochemistry, Genetics & Molecular Biology, Dentistry, Health Professions, Immunology & microbiology, Medicine & Pharmacology, Public Health"
Indonesian Journal of Obstetrics and Gynecology,"Health Professions, Medicine & Pharmacology, Public Health"
Majalah Obstetri & Ginekologi,"Health Professions, Medicine & Pharmacology"
Jurnal Neuroanestesi Indonesia,"Library & Information Science, Medicine & Pharmacology, Neuroscience, Public Health, Social Sciences"
Majalah Anestesia dan Critical Care,"Health Professions, Medicine & Pharmacology"
Indonesian Journal of Urology,"Health Professions, Medicine & Pharmacology, Public Health"
E-Jurnal Medika Udayana,"Health Professions, Medicine & Pharmacology"
Jurnal Farmasi Galenika (Galenika Journal of Pharmacy),"Biochemistry, Genetics & Molecular Biology, Chemistry, Health Professions, Immunology & microbiology, Medicine & Pharmacology"
Journal of Maternal and Child Health,"Medicine & Pharmacology, Public Health"
Berita Kedokteran Masyarakat,Medicine & Pharmacology
ODONTO Dental Journal,Medicine & Pharmacology
AcTion: Aceh Nutrition Journal,"Health Professions, Immunology & microbiology, Medicine & Pharmacology, Public Health"
Jurnal Fitofarmaka Indonesia,"Biochemistry, Genetics & Molecular Biology, Chemistry, Medicine & Pharmacology"
Jurnal Ilmiah Ibnu Sina (JIIS): Ilmu Farmasi dan Kesehatan,Medicine & Pharmacology
Borneo Journal of Pharmacy,Medicine & Pharmacology
Jurnal Gizi dan Dietetik Indonesia (Indonesian Journal of Nutrition and Dietetics),"Health Professions, Medicine & Pharmacology, Public Health, Other"
Molecular and Cellular Biomedical Sciences,"Biochemistry, Genetics & Molecular Biology, Dentistry, Immunology & microbiology, Medicine & Pharmacology, Neuroscience"
Jurnal Mutiara Medika,"Health Professions, Medicine & Pharmacology"
Ilmu Gizi Indonesia,Medicine & Pharmacology
Jurnal Ilmu Kesehatan Masyarakat,"Economics, Econometrics & Finance, Environmental Science, Health Professions, Medicine & Pharmacology, Public Health, Social Sciences"
Media Farmasi: Jurnal Ilmu Farmasi,"Chemistry, Immunology & microbiology, Materials Science & Nanotechnology, Medicine & Pharmacology"
Anterior Jurnal,"Agriculture, Biological Sciences & Forestry, Civil Engineering, Building, Construction & Architecture, Education, Medicine & Pharmacology, Social Sciences"
Biota,"Agriculture, Biological Sciences & Forestry, Biochemistry, Genetics & Molecular Biology, Education, Environmental Science, Medicine & Pharmacology"
Biomedika,"Biochemistry, Genetics & Molecular Biology, Medicine & Pharmacology"
Journal of Tropical Pharmacy and Chemistry,"Agriculture, Biological Sciences & Forestry, Biochemistry, Genetics & Molecular Biology, Chemical Engineering, Chemistry & Bioengineering, Medicine & Pharmacology, Public Health"
Jurnal Farmasi Indonesia,"Biochemistry, Genetics & Molecular Biology, Chemical Engineering, Chemistry & Bioengineering, Immunology & microbiology, Medicine & Pharmacology"
Pharmacology and Clinical Pharmacy Research,Medicine & Pharmacology
Jurnal Farmasi Sains dan Praktis,"Biochemistry, Genetics & Molecular Biology, Health Professions, Immunology & microbiology, Materials Science & Nanotechnology, Medicine & Pharmacology"
Disease Prevention and Public Health Journal (DPPHJ),"Medicine & Pharmacology, Public Health"
Majalah Farmasi dan Farmakologi (Trends in Pharmacy and Pharmaceutical Sciences),Medicine & Pharmacology
Jurnal Ners dan Kebidanan Indonesia,"Health Professions, Medicine & Pharmacology, Nursing, Public Health, Other"
Qanun Medika - Medical Journal Faculty of Medicine Muhammadiyah Surabaya,"Health Professions, Medicine & Pharmacology"
Majalah Kesehatan FKUB,"Medicine & Pharmacology, Public Health"
Jurnal Penyakit Dalam Udayana,"Immunology & microbiology, Medicine & Pharmacology, Public Health"
eJurnal Kedokteran Indonesia,Medicine & Pharmacology
Jurnal Kesehatan Reproduksi,"Health Professions, Medicine & Pharmacology, Nursing, Public Health"
Buletin Farmatera,Medicine & Pharmacology
Jurnal Penelitian Kesehatan,"Health Professions, Medicine & Pharmacology, Nursing, Public Health"
Majalah Kedokteran Andalas,"Health Professions, Medicine & Pharmacology"
JFIOnline,"Health Professions, Medicine & Pharmacology"
Kartika Jurnal Ilmiah Farmasi,"Biochemistry, Genetics & Molecular Biology, Health Professions, Immunology & microbiology, Medicine & Pharmacology"
Medicina,Medicine & Pharmacology
Journal  of Food and Pharmaceutical Sciences,Medicine & Pharmacology
Jurnal Kebidanan dan Keperawatan Aisyiyah,"Health Professions, Medicine & Pharmacology, Nursing, Public Health"
ACI (Acta Cardiologia Indonesiana),Medicine & Pharmacology
Journal of General-Procedural Dermatology & Venereology Indonesia,Medicine & Pharmacology
JBN (Jurnal Bedah Nasional),"Health Professions, Medicine & Pharmacology"
Media Ilmu Kesehatan,"Health Professions, Medicine & Pharmacology, Nursing, Public Health"
Bali Journal of Anesthesiology,"Health Professions, Medicine & Pharmacology, Other"
Majalah Patologi Indonesia,"Biochemistry, Genetics & Molecular Biology, Materials Science & Nanotechnology, Medicine & Pharmacology"
Jurnal Ortopedagogia,"Health Professions, Medicine & Pharmacology"
Pharmascience,Medicine & Pharmacology
Journal of Health Promotion and Behavior,"Medicine & Pharmacology, Public Health"
Jurnal Manajemen Kesehatan Yayasan RS.Dr. Soetomo,"Health Professions, Medicine & Pharmacology, Public Health"
Jurnal Saintika Medika,"Health Professions, Immunology & microbiology, Medicine & Pharmacology, Public Health"
Buletin Anatomi dan Fisiologi (Bulletin of Anatomy and Physiology),"Health Professions, Medicine & Pharmacology, Public Health"
Jurnal JKFT,"Health Professions, Medicine & Pharmacology, Nursing, Public Health"
Jurnal Ilmiah Bidan,"Health Professions, Medicine & Pharmacology, Nursing, Public Health, Other"
The Indonesian Journal of Occupational Safety and Health,"Health Professions, Medicine & Pharmacology"
Health Sciences and Pharmacy Journal,"Health Professions, Medicine & Pharmacology, Nursing, Public Health"
Journal of Health Policy and Management,"Medicine & Pharmacology, Public Health"
Jurnal Ners dan Kebidanan (Journal of Ners and Midwifery),"Health Professions, Medicine & Pharmacology, Nursing, Public Health"
MPI (Media Pharmaceutica Indonesiana),"Chemistry, Health Professions, Immunology & microbiology, Materials Science & Nanotechnology, Medicine & Pharmacology"
Journal of Midwifery,"Medicine & Pharmacology, Social Sciences"
Media Keperawatan Indonesia,"Health Professions, Medicine & Pharmacology, Nursing, Public Health"
Jurnal Riset Hesti Medan Akper Kesdam I/BB Medan,"Health Professions, Medicine & Pharmacology, Nursing, Public Health, Social Sciences"
GEMASSIKA: Jurnal Pengabdian Kepada Masyarakat,"Dentistry, Health Professions, Medicine & Pharmacology, Nursing, Public Health"
Indonesian Journal of Medicine,"Medicine & Pharmacology, Public Health"
Journal of Issues in Midwifery,"Biochemistry, Genetics & Molecular Biology, Health Professions, Medicine & Pharmacology, Nursing, Public Health"
BIOSAINTROPIS (BIOSCIENCE-TROPIC),"Agriculture, Biological Sciences & Forestry, Biochemistry, Genetics & Molecular Biology, Environmental Science, Medicine & Pharmacology"
Husada Mahakam: Jurnal Kesehatan,"Health Professions, Medicine & Pharmacology, Nursing, Public Health"
Jurnal Surya Medika,"Biochemistry, Genetics & Molecular Biology, Health Professions, Immunology & microbiology, Medicine & Pharmacology, Public Health"
Sainsmedika,"Health Professions, Medicine & Pharmacology"
Jurnal Ilmiah Farmasi Farmasyifa (JIFF),"Biochemistry, Genetics & Molecular Biology, Immunology & microbiology, Medicine & Pharmacology"
Oceana Biomedicina Journal,"Biochemistry, Genetics & Molecular Biology, Immunology & microbiology, Medicine & Pharmacology, Public Health"
Majalah Farmaseutik,Medicine & Pharmacology
Jurnal e-Biomedik,Medicine & Pharmacology
JURNAL KEDOKTERAN DAN KESEHATAN,"Biochemistry, Genetics & Molecular Biology, Medicine & Pharmacology, Neuroscience, Public Health"
Review of Primary Care Practice and Education (Kajian Praktik dan Pendidikan Layanan Primer),"Education, Health Professions, Medicine & Pharmacology, Public Health"
Health Notions,"Dentistry, Health Professions, Medicine & Pharmacology, Nursing, Public Health"
Jurnal Midwiferia,"Health Professions, Medicine & Pharmacology, Public Health"
Jurnal Ilmiah Kedokteran Wijaya Kusuma,"Biochemistry, Genetics & Molecular Biology, Medicine & Pharmacology, Public Health"
JPP Jurnal Kesehatan Poltekkes Palembang,"Health Professions, Medicine & Pharmacology, Nursing, Public Health"
Indonesia Medicus Veterinus,"Medicine & Pharmacology, Veterinary"
Journal of Medicine and Health,"Health Professions, Immunology & microbiology, Medicine & Pharmacology, Neuroscience, Public Health"
"Biology, Medicine, & Natural Product Chemistry","Biochemistry, Genetics & Molecular Biology, Medicine & Pharmacology, Public Health"
Jurnal Kesehatan,"Medicine & Pharmacology, Nursing, Public Health"
Jurnal Kedokteran dan Kesehatan,"Medicine & Pharmacology, Neuroscience, Nursing, Public Health"
JCPS (Journal of Current Pharmaceutical Sciences),Medicine & Pharmacology
Medika Kartika : Jurnal Kedokteran dan Kesehatan,"Dentistry, Health Professions, Medicine & Pharmacology, Veterinary"
Radioterapi & Onkologi Indonesia,"Education, Health Professions, Medicine & Pharmacology, Physics, Other"
Warmadewa Medical Journal,"Health Professions, Medicine & Pharmacology"
Jurnal Ilmiah Keperawatan,"Dentistry, Education, Health Professions, Medicine & Pharmacology, Public Health"
JURNAL FARMASI GALENIKA,"Health Professions, Medicine & Pharmacology"
Berkala Ilmiah Kedokteran Duta Wacana,"Biochemistry, Genetics & Molecular Biology, Health Professions, Immunology & microbiology, Medicine & Pharmacology, Public Health"
JURNAL FARMASI GALENIKA,"Health Professions, Medicine & Pharmacology"
Abdimas UNWAHAS : Jurnal Pengabdian Masyarakat UNWAHAS,"Agriculture, Biological Sciences & Forestry, Chemical Engineering, Chemistry & Bioengineering, Economics, Econometrics & Finance, Medicine & Pharmacology, Social Sciences"
Gorontalo Journal of Public Health,"Health Professions, Medicine & Pharmacology, Public Health"
Syifa' MEDIKA:Jurnal Kedokteran dan Kesehatan,"Biochemistry, Genetics & Molecular Biology, Health Professions, Medicine & Pharmacology, Public Health"
Healthy-Mu Journal,"Dentistry, Health Professions, Medicine & Pharmacology"
Jurnal Sporta Saintika,"Humanities, Health Professions, Medicine & Pharmacology, Nursing, Public Health"
As-Syifaa Jurnal Farmasi,Medicine & Pharmacology
Jurnal Farmasi Higea,Medicine & Pharmacology
Jurnal Kesehatan Karya Husada,"Dentistry, Health Professions, Medicine & Pharmacology, Nursing, Public Health"
Jurnal Kesehatan Holistic,"Health Professions, Medicine & Pharmacology, Nursing, Public Health"
"Jambi Medical Journal ""Jurnal Kedokteran dan Kesehatan""",Medicine & Pharmacology
Jurnal Bahana Kesehatan Masyarakat (Bahana of Journal Public Health),"Dentistry, Environmental Science, Medicine & Pharmacology, Nursing, Public Health"
MEDIA INFORMASI,"Dentistry, Medicine & Pharmacology, Nursing, Public Health"
Jurnal Bidang Ilmu Kesehatan,"Biochemistry, Genetics & Molecular Biology, Health Professions, Medicine & Pharmacology, Nursing, Public Health"
"Jurnal Ilmiah PANNMED (Pharmacist, Analyst, Nurse, Nutrition, Midwivery, Environment, Dentist)","Health Professions, Medicine & Pharmacology, Nursing, Public Health"
Jurnal Imejing Diagnostik,"Health Professions, Medicine & Pharmacology"
Majalah Farmasetika,Medicine & Pharmacology
Wiraraja Medika: Jurnal Kesehatan,"Health Professions, Medicine & Pharmacology, Public Health"
Jurnal Ilmiah Kebidanan,"Education, Environmental Science, Health Professions, Medicine & Pharmacology, Public Health"
Medical and Health Science Journal,"Dentistry, Health Professions, Immunology & microbiology, Medicine & Pharmacology"
STOMATOGNATIC- Jurnal Kedokteran Gigi,Medicine & Pharmacology
Jurnal Ilmiah Kebidanan,"Education, Environmental Science, Health Professions, Medicine & Pharmacology, Public Health"
JURNAL ILMIAH OBSGIN : Jurnal Ilmiah Ilmu Kebidanan & Kandungan,"Biochemistry, Genetics & Molecular Biology, Health Professions, Medicine & Pharmacology, Nursing, Public Health"
YARSI Medical Journal,Medicine & Pharmacology
Surya Medika: Jurnal Ilmiah Ilmu Keperawatan dan Ilmu Kesehatan Masyarakat,"Medicine & Pharmacology, Nursing, Public Health"
Indonesian Midwifery Journal,"Education, Health Professions, Medicine & Pharmacology, Nursing"
NURSING UPDATE JURNAL ILMIAH ILMU KEPERAWATAN,"Health Professions, Immunology & microbiology, Medicine & Pharmacology, Nursing, Public Health"
Journal of Mathematical and Fundamental Sciences,Mathematics
International Journal on Emerging Mathematics Education,Education
Journal of Research and Advances in Mathematics Education,"Education, Mathematics"
Al-Jabar : Jurnal Pendidikan Matematika,"Education, Mathematics"
Jurnal Riset Pendidikan Matematika,"Decision Sciences, Operations Research & Management , Education, Mathematics"
International Journal of Education,"Arts, Humanities, Education, Languange, Linguistic, Communication & Media, Mathematics, Physics, Social Sciences"
Journal of Education and Learning,"Economics, Econometrics & Finance, Education, Languange, Linguistic, Communication & Media, Mathematics, Social Sciences"
Jurnal Inovasi Pendidikan IPA,"Agriculture, Biological Sciences & Forestry, Education, Mathematics"
International Journal of Computing Science and Applied Mathematics,"Computer Science & IT, Education, Mathematics"
ASEAN Journal on Science and Technology for Development,"Biochemistry, Genetics & Molecular Biology, Chemical Engineering, Chemistry & Bioengineering, Computer Science & IT, Mathematics"
"ComTech: Computer, Mathematics and Engineering Applications","Computer Science & IT, Engineering, Mathematics"
Limits: Journal of Mathematics and Its Applications,Mathematics
JURNAL ILMIAH GEOMATIKA,"Earth & Planetary Sciences, Mathematics"
Jurnal Pendidikan Matematika,"Education, Mathematics"
Journal of the Indonesian Mathematical Society,Mathematics
AKSIOMA JURNAL PENDIDIKAN MATEMATIKA,"Education, Mathematics"
Jurnal Aplikasi Statistika & Komputasi Statistik,"Computer Science & IT, Decision Sciences, Operations Research & Management , Mathematics"
Journal of Medives,"Education, Mathematics"
JNPM (Jurnal Nasional Pendidikan Matematika),"Education, Mathematics"
Jurnal Mosharafa,"Education, Mathematics"
KALAMATIKA Jurnal Pendidikan Matematika,"Education, Mathematics"
Desimal: Jurnal Matematika,"Education, Mathematics, Social Sciences"
SJME (Supremum Journal of Mathematics Education),"Education, Mathematics, Social Sciences"
MaPan : Jurnal Matematika dan Pembelajaran,"Education, Mathematics"
NUMERICAL (Jurnal Matematika dan Pendidikan Matematika),Mathematics
Teorema: Teori dan Riset Matematika,"Education, Mathematics"
CAUCHY,Mathematics
Jurnal Gantang,"Education, Mathematics"
Jurnal Matematika: MANTIK,Mathematics
Kreano,Mathematics
"ComTech: Computer, Mathematics and Engineering Applications","Computer Science & IT, Engineering, Mathematics"
FIBONACCI: Jurnal Pendidikan Matematika dan Matematika,"Education, Mathematics"
ELSE (Elementary School Education Journal) : Jurnal Pendidikan dan Pembelajaran Sekolah Dasar,"Education, Mathematics, Social Sciences"
Jurnal Fourier,"Computer Science & IT, Economics, Econometrics & Finance, Education, Mathematics"
Jurnal Daya Matematis,Mathematics
Sainmatika: Jurnal Ilmiah Matematika dan Ilmu Pengetahuan Alam,"Agriculture, Biological Sciences & Forestry, Chemistry, Mathematics, Physics"
BAREKENG: JURNAL ILMU MATEMATIKA DAN TERAPAN,"Computer Science & IT, Decision Sciences, Operations Research & Management , Education, Engineering, Mathematics"
Jurnal ILMU DASAR,"Biochemistry, Genetics & Molecular Biology, Chemistry, Mathematics, Physics"
Jurnal Didaktik Matematika,Mathematics
