JOURNAL_TITLE,JOURNAL_SUBJECTS
Jurnal Serambi Engineering,"Chemical Engineering, Chemistry & Bioengineering, Civil Engineering, Building, Construction & Architecture, Computer Science & IT, Engineering, Environmental Science"
KLIK - KUMPULAN JURNAL ILMU KOMPUTER,Computer Science & IT
PROtek,"Computer Science & IT, Control & Systems Engineering, Electrical & Electronics Engineering, Energy"
JTET (Jurnal Teknik Elektro Terapan),"Computer Science & IT, Electrical & Electronics Engineering"
Jurnal Informatika,Computer Science & IT
EDUTIC,"Computer Science & IT, Education"
Jurnal Sains & Teknologi Lingkungan,"Computer Science & IT, Education"
POSITIF,Computer Science & IT
SMARTICS Journal,"Computer Science & IT, Control & Systems Engineering, Decision Sciences, Operations Research & Management , Electrical & Electronics Engineering"
Jurnal Ilmiah Teknosains,Computer Science & IT
IJCIT (Indonesian Journal on Computer and Information Technology),Computer Science & IT
Indonesian Journal on Computing (Indo-JC),Computer Science & IT
JURNAL ILMU DAN TEKNOLOGI PETERNAKAN,Computer Science & IT
CYBERNETICS,Computer Science & IT
Krea-TIF: Jurnal Teknik Informatika,"Computer Science & IT, Control & Systems Engineering, Library & Information Science"
Jurnal Teknologi dan Informasi,Computer Science & IT
Infotekmesin,"Computer Science & IT, Electrical & Electronics Engineering, Mechanical Engineering"
JURNAL EDUCATION AND DEVELOPMENT,"Agriculture, Biological Sciences & Forestry, Arts, Humanities, Computer Science & IT, Education, Languange, Linguistic, Communication & Media"
INFORMAL: Informatics Journal,Computer Science & IT
CCIT (Creative Communication and Innovative Technology) Journal,Computer Science & IT
Infotekmesin,"Computer Science & IT, Electrical & Electronics Engineering, Mechanical Engineering"
JURNAL EDUCATION AND DEVELOPMENT,"Agriculture, Biological Sciences & Forestry, Arts, Humanities, Computer Science & IT, Education, Languange, Linguistic, Communication & Media"
INFORMAL: Informatics Journal,Computer Science & IT
"Journal of Game, Game Art, and Gamification (JGGAG)","Arts, Computer Science & IT"
Jurnal Ilmiah Teknologi Informasi Asia,Computer Science & IT
Technomedia Journal,"Computer Science & IT, Languange, Linguistic, Communication & Media"
Jurnal Manajemen Informatika dan Sistem Informasi,Computer Science & IT
DOUBLECLICK: Journal of Computer and Information Technology,Computer Science & IT
Computer Based Information System Journal,"Computer Science & IT, Control & Systems Engineering, Library & Information Science"
Jurnal PIKSEL (Penelitian Ilmu Komputer Sistem Embedded & Logic),"Computer Science & IT, Decision Sciences, Operations Research & Management"
Infoman's,Computer Science & IT
INFORMATION SYSTEM FOR EDUCATORS AND PROFESSIONALS,"Computer Science & IT, Control & Systems Engineering, Decision Sciences, Operations Research & Management , Engineering, Other"
Dinamika Informatika,Computer Science & IT
Antivirus : Jurnal Ilmiah Teknik Informatika,Computer Science & IT
Jurnal INSTEK (Informatika Sains dan Teknologi),"Computer Science & IT, Control & Systems Engineering, Decision Sciences, Operations Research & Management , Engineering"
JUTIM (Jurnal Teknik Informatika Musirawas),"Computer Science & IT, Control & Systems Engineering, Engineering, Other"
J-SAKTI (Jurnal Sains Komputer dan Informatika),Computer Science & IT
Jurnal AKSI (Akuntansi dan Sistem Informasi),"Computer Science & IT, Economics, Econometrics & Finance"
Jurnal Pendidikan Informatika dan Sains,"Chemical Engineering, Chemistry & Bioengineering, Computer Science & IT, Physics"
Jurnal Abdimas PHB : Jurnal Pengabdian Masyarakat Progresif Humanis Brainstorming,"Automotive Engineering, Computer Science & IT, Mechanical Engineering, Public Health"
JURNAL TIARSIE,"Civil Engineering, Building, Construction & Architecture, Computer Science & IT, Electrical & Electronics Engineering, Engineering"
Jurnal Teknologi Informasi dan Pendidikan,"Computer Science & IT, Control & Systems Engineering, Education, Engineering"
RABIT: Jurnal Teknologi dan Sistem Informasi Univrab,"Computer Science & IT, Engineering"
INOVTEK POLBENG,Computer Science & IT
Voice Of Informatics,Computer Science & IT
"TRANSFORMATIKA: JURNAL BAHASA, SASTRA, DAN PENGAJARANNYA",Computer Science & IT
Compiler,Computer Science & IT
Bina Insani ICT Journal,Computer Science & IT
JURNAL KAJIAN TEKNIK ELEKTRO,"Computer Science & IT, Control & Systems Engineering, Electrical & Electronics Engineering"
KOMTEKINFO,Computer Science & IT
Smart Comp,"Computer Science & IT, Control & Systems Engineering"
Menara Ilmu,"Agriculture, Biological Sciences & Forestry, Computer Science & IT, Education"
Technologia: Jurnal Ilmiah,Computer Science & IT
International Journal of Innovation in Enterprise System,"Computer Science & IT, Control & Systems Engineering"
Jurnal Teknologi Terpadu,"Computer Science & IT, Engineering"
Buana Ilmu,"Computer Science & IT, Economics, Econometrics & Finance, Education, Engineering, Law, Crime, Criminology & Criminal Justice"
Jurnal Technopreneur (JTech),"Agriculture, Biological Sciences & Forestry, Computer Science & IT, Energy, Mechanical Engineering, Other"
Jurnal Ilmiah Media Sisfo,Computer Science & IT
JURNAL REKAYASA SISTEM INDUSTRI,"Computer Science & IT, Economics, Econometrics & Finance, Industrial & Manufacturing Engineering, Materials Science & Nanotechnology"
Jutisi: Jurnal Ilmiah Teknik Informatika dan Sistem Informasi,Computer Science & IT
Jurnal Madani,"Religion, Computer Science & IT, Decision Sciences, Operations Research & Management , Economics, Econometrics & Finance, Education"
Jurnal Teknologi,"Computer Science & IT, Electrical & Electronics Engineering, Industrial & Manufacturing Engineering, Mechanical Engineering"
Altius: Jurnal Ilmu Olahraga dan Kesehatan,"Computer Science & IT, Education, Public Health"
"Jurnal Fokus Elektroda : Energi Listrik, Telekomunikasi, Komputer, Elektronika dan Kendali","Computer Science & IT, Control & Systems Engineering, Electrical & Electronics Engineering"
JURNAL SISTEM INFORMASI,"Computer Science & IT, Decision Sciences, Operations Research & Management , Library & Information Science, Other"
Jurnal Buana Informatika,Computer Science & IT
JURNAL MASYARAKAT INFORMATIKA,Computer Science & IT
Network Engineering Research Operation [NERO],Computer Science & IT
J-ENSITEC,"Civil Engineering, Building, Construction & Architecture, Computer Science & IT, Industrial & Manufacturing Engineering, Mechanical Engineering"
"TELEKONTRAN: Jurnal Ilmiah Telekomunikasi, Kendali dan Elektronika Terapan","Computer Science & IT, Control & Systems Engineering"
Jurnal Eksplora Informatika,Computer Science & IT
TEKNOLOGI: Jurnal Ilmiah Sistem Informasi,"Computer Science & IT, Decision Sciences, Operations Research & Management , Electrical & Electronics Engineering, Engineering, Mathematics"
Majalah Bisnis Dan IPTEK,Computer Science & IT
AL ULUM JURNAL SAINS DAN TEKNOLOGI,"Computer Science & IT, Education, Mathematics"
Edu Komputika Journal,Computer Science & IT
Information Management For Educators And Professionals (IMBI),"Computer Science & IT, Control & Systems Engineering, Decision Sciences, Operations Research & Management , Engineering, Other"
SAINTEKBU,"Computer Science & IT, Control & Systems Engineering, Library & Information Science"
Jurnal TIKA,Computer Science & IT
Jurnal Teknovasi : Jurnal Teknik dan Inovasi,"Aerospace Engineering, Agriculture, Biological Sciences & Forestry, Computer Science & IT, Engineering, Industrial & Manufacturing Engineering, Materials Science & Nanotechnology"
Ecosystem,"Computer Science & IT, Electrical & Electronics Engineering, Engineering, Social Sciences"
Informasi Interaktif,Computer Science & IT
Journal Information System Development (ISD),Computer Science & IT
Jurnal Informatika Global,Computer Science & ITdJurnal Informatika Upgris,Computer Science & ITdInformasi Interaktif,Computer Science & ITdJurnal Informatika Global,Computer Science & ITdINAQUE: Journal of Industrial & Quality Engineering,"Computer Science & IT, Economics, Econometrics & Finance, Engineering, Industrial & Manufacturing Engineering, Mechanical Engineering"dJurnal Mantik Penusa,"Computer Science & IT, Control & Systems Engineering, Decision Sciences, Operations Research & Management"dMajalah Ilmiah UNIKOM,"Arts, Humanities, Computer Science & IT, Engineering, Law, Crime, Criminology & Criminal Justice, Social Sciences"dJurnal Algoritma,Computer Science & ITdJurnal Teknologi Informasi dan Komputer,"Computer Science & IT, Control & Systems Engineering, Economics, Econometrics & Finance, Education, Engineering, Social Sciences"dJurnal Teknologi Informasi,Computer Science & ITdINTEKNA,"Computer Science & IT, Economics, Econometrics & Finance, Electrical & Electronics Engineering, Other"dIKRA-ITH ABDIMAS,Computer Science & ITdIKRA-ITH ABDIMAS,Computer Science & ITdINTEKNA,"Computer Science & IT, Economics, Econometrics & Finance, Electrical & Electronics Engineering, Other"dIKRA-ITH ABDIMAS,Computer Science & IT
Forest and Society,"Agriculture, Biological Sciences & Forestry, Environmental Science, Social Sciences"
Journal of the Indonesian Tropical Animal Agriculture,"Agriculture, Biological Sciences & Forestry, Earth & Planetary Sciences"
Tropical Animal Science Journal,"Agriculture, Biological Sciences & Forestry, Energy"
"AGRIVITA, Journal of Agricultural Science","Agriculture, Biological Sciences & Forestry"
HAYATI Journal of Biosciences,"Agriculture, Biological Sciences & Forestry, Earth & Planetary Sciences"
Journal of Degraded and Mining Lands Management,"Agriculture, Biological Sciences & Forestry, Biochemistry, Genetics & Molecular Biology"
Indonesian Journal of Forestry Research,"Agriculture, Biological Sciences & Forestry"
Indonesian Aquaculture Journal,"Agriculture, Biological Sciences & Forestry, Biochemistry, Genetics & Molecular Biology"
MANAJEMEN HUTAN TROPIKA Journal of Tropical Forest Management,"Agriculture, Biological Sciences & Forestry"
Squalen Bulletin of Marine and Fisheries Postharvest and Biotechnology,"Agriculture, Biological Sciences & Forestry, Biochemistry, Genetics & Molecular Biology, Environmental Science, Immunology & microbiology"
Forum Penelitian Agro Ekonomi,"Agriculture, Biological Sciences & Forestry, Economics, Econometrics & Finance"
Jurnal Pascapanen Pertanian,"Agriculture, Biological Sciences & Forestry"
Jurnal Agronomi Indonesia (Indonesian Journal of Agronomy),"Agriculture, Biological Sciences & Forestry, Economics, Econometrics & Finance"
BERITA BIOLOGI,"Agriculture, Biological Sciences & Forestry, Biochemistry, Genetics & Molecular Biology"
Jurnal Ilmu dan Teknologi Kayu Tropis,"Agriculture, Biological Sciences & Forestry"
Analisis Kebijakan Pertanian,"Agriculture, Biological Sciences & Forestry"
Jurnal Agro Ekonomi,"Agriculture, Biological Sciences & Forestry"
Jurnal Pascapanen dan Bioteknologi Kelautan dan Perikanan,"Agriculture, Biological Sciences & Forestry, Biochemistry, Genetics & Molecular Biology, Environmental Science"
Buletin Palawija,"Agriculture, Biological Sciences & Forestry"
Jurnal Pendidikan Biologi Indonesia,"Agriculture, Biological Sciences & Forestry"
Jurnal Penyuluhan,"Agriculture, Biological Sciences & Forestry"
Jurnal Pengolahan Hasil Perikanan Indonesia,"Agriculture, Biological Sciences & Forestry"
Jurnal Hortikultura,"Agriculture, Biological Sciences & Forestry"
Indonesian Journal of Agricultural Science,"Agriculture, Biological Sciences & Forestry"
Jurnal AgroBiogen,"Agriculture, Biological Sciences & Forestry"
Jurnal Penelitian Perikanan Indonesia,"Agriculture, Biological Sciences & Forestry, Biochemistry, Genetics & Molecular Biology"
Jurnal Kebijakan Perikanan Indonesia,"Agriculture, Biological Sciences & Forestry"
Jurnal Iktiologi Indonesia,"Agriculture, Biological Sciences & Forestry, Education, Public Health"
Jurnal Inovasi Pendidikan IPA,"Agriculture, Biological Sciences & Forestry, Education, Mathematics"
Jurnal Riset Akuakultur,"Agriculture, Biological Sciences & Forestry, Biochemistry, Genetics & Molecular Biology"
Jurnal Tanah dan Iklim,"Agriculture, Biological Sciences & Forestry, Social Sciences, Other"
Jurnal Sylva Lestari,"Agriculture, Biological Sciences & Forestry, Biochemistry, Genetics & Molecular Biology, Economics, Econometrics & Finance"
Indonesian Fisheries Research Journal,"Agriculture, Biological Sciences & Forestry, Biochemistry, Genetics & Molecular Biology"
Jurnal Penelitian Kelapa Sawit,"Agriculture, Biological Sciences & Forestry"
Pelita Perkebunan (Coffee and Cocoa Research Journal),"Agriculture, Biological Sciences & Forestry"
Jurnal Tanaman Industri dan Penyegar,"Agriculture, Biological Sciences & Forestry, Biochemistry, Genetics & Molecular Biology, Industrial & Manufacturing Engineering"
Buletin Ilmiah Marina Sosial Ekonomi Kelautan dan Perikanan,"Agriculture, Biological Sciences & Forestry, Environmental Science"
Jurnal Agro,"Agriculture, Biological Sciences & Forestry"
Jurnal Akuakultur Indonesia,"Agriculture, Biological Sciences & Forestry"
Biosaintifika: Journal of Biology & Biology Education,"Agriculture, Biological Sciences & Forestry"
BAWAL Widya Riset Perikanan Tangkap,"Agriculture, Biological Sciences & Forestry, Biochemistry, Genetics & Molecular Biology"
Journal of Tropical Crop Science,"Agriculture, Biological Sciences & Forestry"
Jurnal Bioteknologi & Biosains Indonesia (JBBI),"Agriculture, Biological Sciences & Forestry, Biochemistry, Genetics & Molecular Biology, Immunology & microbiology"
"Buletin Tanaman Tembakau, Serat & Minyak Industri","Agriculture, Biological Sciences & Forestry"
Jurnal Ilmu Kehutanan,"Agriculture, Biological Sciences & Forestry"
Industria: Jurnal Teknologi dan Manajemen Agroindustri,"Agriculture, Biological Sciences & Forestry, Biochemistry, Genetics & Molecular Biology, Chemical Engineering, Chemistry & Bioengineering, Control & Systems Engineering, Decision Sciences, Operations Research & Management , Economics, Econometrics & Finance, Engineering, Environmental Science, Industrial & Manufacturing Engineering, Materials Science & Nanotechnology, Medicine & Pharmacology, Other"
Jurnal Sosial Ekonomi Kelautan dan Perikanan,"Agriculture, Biological Sciences & Forestry, Economics, Econometrics & Finance, Environmental Science, Social Sciences"
Jurnal Perlindungan Tanaman Indonesia,"Agriculture, Biological Sciences & Forestry"
AGRARIS: Journal of Agribusiness and Rural Development Research,"Agriculture, Biological Sciences & Forestry, Economics, Econometrics & Finance, Social Sciences"
Warta Perkaretan,"Agriculture, Biological Sciences & Forestry"
Journal of Tropical Biodiversity and Biotechnology,"Agriculture, Biological Sciences & Forestry, Biochemistry, Genetics & Molecular Biology, Environmental Science, Immunology & microbiology"
Jurnal Manajemen dan Agribisnis,"Agriculture, Biological Sciences & Forestry, Economics, Econometrics & Finance"
Media Akuakultur,"Agriculture, Biological Sciences & Forestry, Biochemistry, Genetics & Molecular Biology"
Omni-Akuatika,"Agriculture, Biological Sciences & Forestry, Biochemistry, Genetics & Molecular Biology, Environmental Science"
Caraka Tani: Journal of Sustainable Agriculture,"Agriculture, Biological Sciences & Forestry"
Biogenesis,"Agriculture, Biological Sciences & Forestry"
JURNAL PERBENIHAN TANAMAN HUTAN,"Agriculture, Biological Sciences & Forestry, Biochemistry, Genetics & Molecular Biology, Earth & Planetary Sciences"
Jurnal Penelitian Kehutanan Wallacea,"Agriculture, Biological Sciences & Forestry, Decision Sciences, Operations Research & Management"
Jurnal Teknologi & Industri Hasil Pertanian,"Agriculture, Biological Sciences & Forestry, Computer Science & IT, Industrial & Manufacturing Engineering"
Jurnal Ilmu Pertanian Indonesia,"Agriculture, Biological Sciences & Forestry"
Marine Fisheries: JURNAL TEKNOLOGI DAN MANAJEMEN PERIKANAN LAUT,"Agriculture, Biological Sciences & Forestry"
Jurnal Aplikasi Teknologi Pangan,"Agriculture, Biological Sciences & Forestry, Chemical Engineering, Chemistry & Bioengineering, Chemistry, Immunology & microbiology, Other"
E-Journal Menara Perkebunan,"Agriculture, Biological Sciences & Forestry"
Jurnal Penelitian Hutan Tanaman,"Agriculture, Biological Sciences & Forestry, Decision Sciences, Operations Research & Management"
Jurnal Teknologi Dan Industri Pangan,"Agriculture, Biological Sciences & Forestry, Industrial & Manufacturing Engineering"
Jurnal Penelitian Pertanian Tanaman Pangan,"Agriculture, Biological Sciences & Forestry"
Jurnal Teknologi Industri Pertanian,"Agriculture, Biological Sciences & Forestry, Engineering, Industrial & Manufacturing Engineering"
Jurnal Hortikultura Indonesia,"Agriculture, Biological Sciences & Forestry"
Jurnal Penelitian Hasil Hutan,"Agriculture, Biological Sciences & Forestry, Decision Sciences, Operations Research & Management"
Jurnal Riset Industri Hasil Hutan,"Agriculture, Biological Sciences & Forestry, Chemical Engineering, Chemistry & Bioengineering, Chemistry, Industrial & Manufacturing Engineering, Materials Science & Nanotechnology"
Sains Peternakan: Jurnal Penelitian Ilmu Peternakan,"Agriculture, Biological Sciences & Forestry, Veterinary"
AGROSAINSTEK: Jurnal Ilmu dan Teknologi Pertanian,"Agriculture, Biological Sciences & Forestry, Biochemistry, Genetics & Molecular Biology, Environmental Science"
Agriekonomika,"Agriculture, Biological Sciences & Forestry, Economics, Econometrics & Finance"
Jurnal Entomologi Indonesia,"Agriculture, Biological Sciences & Forestry, Biochemistry, Genetics & Molecular Biology"
Jurnal Perikanan Universitas Gadjah Mada,"Agriculture, Biological Sciences & Forestry, Biochemistry, Genetics & Molecular Biology, Immunology & microbiology"
Jurnal Sumberdaya Lahan,"Agriculture, Biological Sciences & Forestry, Earth & Planetary Sciences"
Ilmu Pertanian (Agricultural Science),"Agriculture, Biological Sciences & Forestry"
Peronema Forestry Science Journal,"Agriculture, Biological Sciences & Forestry"
JURNAL ANALISIS KEBIJAKAN KEHUTANAN,"Agriculture, Biological Sciences & Forestry"
Jurnal Penelitian Hutan dan Konservasi Alam,"Agriculture, Biological Sciences & Forestry"
Jurnal Planta Tropika,"Agriculture, Biological Sciences & Forestry"
Jurnal Penelitian dan Pengembangan Pertanian,"Agriculture, Biological Sciences & Forestry, Decision Sciences, Operations Research & Management"
Informatika Pertanian,"Agriculture, Biological Sciences & Forestry, Computer Science & IT"
JURNAL HAMA DAN PENYAKIT TUMBUHAN TROPIKA,"Agriculture, Biological Sciences & Forestry"
Agrointek,"Agriculture, Biological Sciences & Forestry, Biochemistry, Genetics & Molecular Biology"
Buletin Kebun Raya,"Agriculture, Biological Sciences & Forestry"
ANNALES BOGORIENSES,"Agriculture, Biological Sciences & Forestry, Biochemistry, Genetics & Molecular Biology, Chemical Engineering, Chemistry & Bioengineering, Chemistry, Immunology & microbiology, Medicine & Pharmacology"
Jurnal Pengkajian dan Pengembangan Teknologi Pertanian,"Agriculture, Biological Sciences & Forestry, Engineering"
ZOO INDONESIA,"Agriculture, Biological Sciences & Forestry, Other"
Agro Ekonomi,"Agriculture, Biological Sciences & Forestry, Economics, Econometrics & Finance"
ECSOFIM (Economic and Social of Fisheries and Marine),"Agriculture, Biological Sciences & Forestry, Arts, Humanities, Decision Sciences, Operations Research & Management , Environmental Science"
JURNAL PEMULIAAN TANAMAN HUTAN,"Agriculture, Biological Sciences & Forestry"
International Journal of Applied Biology,"Agriculture, Biological Sciences & Forestry, Automotive Engineering, Energy, Environmental Science"
Jurnal Industri Hasil Perkebunan,"Agriculture, Biological Sciences & Forestry, Chemical Engineering, Chemistry & Bioengineering, Environmental Science, Industrial & Manufacturing Engineering"
Biopropal Industri,"Agriculture, Biological Sciences & Forestry, Industrial & Manufacturing Engineering"
Jurnal Warta Industri Hasil Pertanian,"Agriculture, Biological Sciences & Forestry, Industrial & Manufacturing Engineering"
Jurnal Penelitian Karet,"Agriculture, Biological Sciences & Forestry, Education"
Jurnal Kebijakan Sosial Ekonomi Kelautan dan Perikanan,"Agriculture, Biological Sciences & Forestry, Environmental Science"
JURNAL PANGAN,"Agriculture, Biological Sciences & Forestry, Social Sciences"
Floribunda,"Agriculture, Biological Sciences & Forestry, Biochemistry, Genetics & Molecular Biology"
BIOEDUSCIENCE,"Agriculture, Biological Sciences & Forestry, Biochemistry, Genetics & Molecular Biology, Education"
Majalah Ilmiah Biologi BIOSFERA: A Scientific Journal,"Agriculture, Biological Sciences & Forestry, Biochemistry, Genetics & Molecular Biology, Environmental Science"
Jurnal AGROTEKNOLOGI,"Agriculture, Biological Sciences & Forestry"
Riau Journal of Empowerment,"Agriculture, Biological Sciences & Forestry, Economics, Econometrics & Finance, Education, Social Sciences"
Jurnal Hutan Tropis,"Agriculture, Biological Sciences & Forestry"
Jurnal Penelitian Pendidikan IPA,"Agriculture, Biological Sciences & Forestry, Biochemistry, Genetics & Molecular Biology, Chemical Engineering, Chemistry & Bioengineering, Chemistry, Education, Materials Science & Nanotechnology, Physics"
BHUMI: Jurnal Agraria dan Pertanahan,"Agriculture, Biological Sciences & Forestry, Law, Crime, Criminology & Criminal Justice, Social Sciences"
Jurnal Ilmu Peternakan dan Veteriner Tropis (JIPVET),"Agriculture, Biological Sciences & Forestry, Biochemistry, Genetics & Molecular Biology, Economics, Econometrics & Finance, Veterinary"
Biota,"Agriculture, Biological Sciences & Forestry"
JURNAL PRESIPITASI,"Agriculture, Biological Sciences & Forestry, Earth & Planetary Sciences"
Jurnal AGRISEP,"Agriculture, Biological Sciences & Forestry, Economics, Econometrics & Finance"
Vegetalika,"Agriculture, Biological Sciences & Forestry"
Jurnal Teknologi Pertanian Andalas,"Agriculture, Biological Sciences & Forestry, Computer Science & IT"
Jurnal Ilmiah Manuntung,"Agriculture, Biological Sciences & Forestry"
Jurnal Agribisnis Indonesia,"Agriculture, Biological Sciences & Forestry, Economics, Econometrics & Finance"
Jurnal Agrotek Tropika,"Agriculture, Biological Sciences & Forestry"
Jurnal Ilmiah Rekayasa Pertanian dan Biosistem,"Agriculture, Biological Sciences & Forestry"
Journal of Applied Agricultural Science and Technology,"Agriculture, Biological Sciences & Forestry, Engineering, Environmental Science"
Indonesian Journal of Chemical Research,"Agriculture, Biological Sciences & Forestry, Biochemistry, Genetics & Molecular Biology, Chemical Engineering, Chemistry & Bioengineering, Chemistry, Environmental Science"
Savana Cendana,"Agriculture, Biological Sciences & Forestry"
JURNAL GALUNG TROPIKA,"Agriculture, Biological Sciences & Forestry"
Agrotechnology Research Journal,"Agriculture, Biological Sciences & Forestry"
AGROLAND,"Agriculture, Biological Sciences & Forestry"
"Canrea Journal: Food Technology, Nutritions, and Culinary Journal","Agriculture, Biological Sciences & Forestry"
Agrisocionomics: Jurnal Sosial Ekonomi Pertanian,"Agriculture, Biological Sciences & Forestry"
JURNAL AGRICA,"Agriculture, Biological Sciences & Forestry"
Anterior Jurnal,"Agriculture, Biological Sciences & Forestry, Civil Engineering, Building, Construction & Architecture, Education, Medicine & Pharmacology, Social Sciences"
Biota,"Agriculture, Biological Sciences & Forestry, Biochemistry, Genetics & Molecular Biology, Education, Environmental Science, Medicine & Pharmacology"
Sainmatika: Jurnal Ilmiah Matematika dan Ilmu Pengetahuan Alam,"Agriculture, Biological Sciences & Forestry, Chemistry, Mathematics, Physics"
Jurnal Ilmu Produksi dan Teknologi Hasil Peternakan,"Agriculture, Biological Sciences & Forestry, Biochemistry, Genetics & Molecular Biology, Veterinary"
Scripta Biologica,"Agriculture, Biological Sciences & Forestry, Biochemistry, Genetics & Molecular Biology"
Jurnal Biologi Papua,"Agriculture, Biological Sciences & Forestry"
Jurnal Teknik Pertanian Lampung (Journal of Agricultural Engineering),"Agriculture, Biological Sciences & Forestry, Engineering"
"BIOLINK (Jurnal Biologi Lingkungan, Industri, Kesehatan)","Agriculture, Biological Sciences & Forestry, Biochemistry, Genetics & Molecular Biology"
REKAYASA,"Agriculture, Biological Sciences & Forestry, Computer Science & IT, Electrical & Electronics Engineering, Engineering, Physics"
Journal of Tropical Pharmacy and Chemistry,"Agriculture, Biological Sciences & Forestry, Biochemistry, Genetics & Molecular Biology, Chemical Engineering, Chemistry & Bioengineering, Medicine & Pharmacology, Public Health"
Jukung (Jurnal Teknik Lingkungan),"Agriculture, Biological Sciences & Forestry, Chemistry, Civil Engineering, Building, Construction & Architecture, Engineering, Environmental Science"
AGRIMOR,"Agriculture, Biological Sciences & Forestry, Economics, Econometrics & Finance"
Jurnal Penelitian Pertanian Terapan,"Agriculture, Biological Sciences & Forestry"
Jurnal Agrise,"Agriculture, Biological Sciences & Forestry, Economics, Econometrics & Finance"
Jurnal Agro Industri Perkebunan,"Agriculture, Biological Sciences & Forestry"
"Agriprima, Journal of Applied Agricultural Sciences","Agriculture, Biological Sciences & Forestry"
TEKNOLOGI PANGAN : Media Informasi dan Komunikasi Ilmiah Teknologi Pertanian,"Agriculture, Biological Sciences & Forestry"
AGROMIX,"Agriculture, Biological Sciences & Forestry"
Jurnal Agroqua: Media Informasi Agronomi dan Budidaya Perairan,"Agriculture, Biological Sciences & Forestry, Earth & Planetary Sciences"
Gontor AGROTECH Science Journal,"Agriculture, Biological Sciences & Forestry, Education"
Jurnal Pendidikan dan Pembelajaran Sains Indonesia (JPPSI),"Agriculture, Biological Sciences & Forestry"
Jurnal Biologi Udayana,"Agriculture, Biological Sciences & Forestry, Biochemistry, Genetics & Molecular Biology"
JURNAL PETERNAKAN,"Agriculture, Biological Sciences & Forestry"
