JOURNAL_TITLE,JOURNAL_SUBJECTS
Jurnal Tanaman Industri dan Penyegar,"Agriculture, Biological Sciences & Forestry, Biochemistry, Genetics & Molecular Biology, Industrial & Manufacturing Engineering"
Jurnal Litbang Industri,Industrial & Manufacturing Engineering
Industria: Jurnal Teknologi dan Manajemen Agroindustri,"Agriculture, Biological Sciences & Forestry, Biochemistry, Genetics & Molecular Biology, Chemical Engineering, Chemistry & Bioengineering, Control & Systems Engineering, Decision Sciences, Operations Research & Management , Economics, Econometrics & Finance, Engineering, Environmental Science, Industrial & Manufacturing Engineering, Materials Science & Nanotechnology, Medicine & Pharmacology, Other"
Jurnal Ilmiah Teknik Industri,Industrial & Manufacturing Engineering
Jurnal Dinamika Penelitian Industri,Industrial & Manufacturing Engineering
Jurnal Optimasi Sistem Industri,"Control & Systems Engineering, Decision Sciences, Operations Research & Management , Engineering, Industrial & Manufacturing Engineering, Mechanical Engineering"
Jurnal Teknologi & Industri Hasil Pertanian,"Agriculture, Biological Sciences & Forestry, Computer Science & IT, Industrial & Manufacturing Engineering"
Jurnal Penelitian Tanaman Industri,Industrial & Manufacturing Engineering
Jurnal Teknologi Dan Industri Pangan,"Agriculture, Biological Sciences & Forestry, Industrial & Manufacturing Engineering"
Jurnal Teknologi Industri Pertanian,"Agriculture, Biological Sciences & Forestry, Engineering, Industrial & Manufacturing Engineering"
Jurnal Riset Industri Hasil Hutan,"Agriculture, Biological Sciences & Forestry, Chemical Engineering, Chemistry & Bioengineering, Chemistry, Industrial & Manufacturing Engineering, Materials Science & Nanotechnology"
Majalah Ilmiah Pengkajian Industri,"Aerospace Engineering, Chemical Engineering, Chemistry & Bioengineering, Engineering, Industrial & Manufacturing Engineering, Transportation"
Jurnal Teknik Industri,Industrial & Manufacturing Engineering
Journal of Industrial Research (Jurnal Riset Industri),Industrial & Manufacturing Engineering
Jurnal Riset Teknologi Pencegahan Pencemaran Industri,Industrial & Manufacturing Engineering
Jurnal Industri Hasil Perkebunan,"Agriculture, Biological Sciences & Forestry, Chemical Engineering, Chemistry & Bioengineering, Environmental Science, Industrial & Manufacturing Engineering"
Biopropal Industri,"Agriculture, Biological Sciences & Forestry, Industrial & Manufacturing Engineering"
Jurnal Warta Industri Hasil Pertanian,"Agriculture, Biological Sciences & Forestry, Industrial & Manufacturing Engineering"
J@TI (TEKNIK INDUSTRI),Industrial & Manufacturing Engineering
INVOTEK: Jurnal Inovasi Vokasional dan Teknologi,"Automotive Engineering, Civil Engineering, Building, Construction & Architecture, Computer Science & IT, Control & Systems Engineering, Electrical & Electronics Engineering, Energy, Engineering, Industrial & Manufacturing Engineering, Transportation"
Jurnal Teknologi Rekayasa,"Civil Engineering, Building, Construction & Architecture, Computer Science & IT, Electrical & Electronics Engineering, Industrial & Manufacturing Engineering, Mechanical Engineering"
Jurnal Sistem dan Manajemen Industri,"Engineering, Industrial & Manufacturing Engineering, Transportation"
Indonesian Journal of Informatics Education,"Computer Science & IT, Control & Systems Engineering, Education, Electrical & Electronics Engineering, Industrial & Manufacturing Engineering"
Jurnal IPTEK,"Civil Engineering, Building, Construction & Architecture, Computer Science & IT, Industrial & Manufacturing Engineering, Mechanical Engineering"
Nature: National Academic Journal of Architecture,"Aerospace Engineering, Arts, Humanities, Engineering, Industrial & Manufacturing Engineering, Other"
Dinamika Teknik Mesin,"Automotive Engineering, Engineering, Industrial & Manufacturing Engineering, Materials Science & Nanotechnology, Mechanical Engineering"
Faktor Exacta,"Civil Engineering, Building, Construction & Architecture, Computer Science & IT, Control & Systems Engineering, Electrical & Electronics Engineering, Industrial & Manufacturing Engineering"
Jurnal Ilmiah Arena Tekstil,Industrial & Manufacturing Engineering
Journal of Industrial Engineering Management,"Control & Systems Engineering, Decision Sciences, Operations Research & Management , Energy, Engineering, Industrial & Manufacturing Engineering"
JISI UMJ (Jurnal Integrasi Sistem Industri UMJ),Industrial & Manufacturing Engineering
SINTEK JURNAL: Jurnal Ilmiah Teknik Mesin,"Automotive Engineering, Control & Systems Engineering, Industrial & Manufacturing Engineering, Materials Science & Nanotechnology, Mechanical Engineering"
Journal of Engineering and Management in Industrial System,Industrial & Manufacturing Engineering
SPEKTRUM INDUSTRI,Industrial & Manufacturing Engineering
Jurnal Ilmiah Dinamika Rekayasa (DINAREK),"Civil Engineering, Building, Construction & Architecture, Control & Systems Engineering, Electrical & Electronics Engineering, Engineering, Industrial & Manufacturing Engineering"
Jurnal Telematika,"Computer Science & IT, Control & Systems Engineering, Electrical & Electronics Engineering, Industrial & Manufacturing Engineering"
Journal of Research and Technology,"Chemical Engineering, Chemistry & Bioengineering, Engineering, Environmental Science, Industrial & Manufacturing Engineering"
Jurnal Inotera,"Computer Science & IT, Engineering, Industrial & Manufacturing Engineering, Materials Science & Nanotechnology, Mechanical Engineering"
JURNAL MANAJEMEN INDUSTRI DAN LOGISTIK,"Decision Sciences, Operations Research & Management , Engineering, Industrial & Manufacturing Engineering, Transportation"
Jurnal Taman Vokasi,"Automotive Engineering, Education, Engineering, Industrial & Manufacturing Engineering, Mechanical Engineering"
Jurnal Akuatika Indonesia,"Energy, Environmental Science, Health Professions, Immunology & microbiology, Industrial & Manufacturing Engineering"
Jurnal POLIMESIN,"Automotive Engineering, Control & Systems Engineering, Energy, Industrial & Manufacturing Engineering, Materials Science & Nanotechnology"
Journal Sampurasun : Interdisciplinary Studies for Cultural Heritage,"Humanities, Computer Science & IT, Education, Industrial & Manufacturing Engineering, Social Sciences"
Jurnal Rekayasa Sistem & Industri (JRSI),"Computer Science & IT, Control & Systems Engineering, Industrial & Manufacturing Engineering"
"JOURNAL OF MECHANICAL ENGINEERING, MANUFACTURES, MATERIALS AND ENERGY","Energy, Industrial & Manufacturing Engineering, Mechanical Engineering"
PERFORMA : Media Ilmiah Teknik Industri,"Engineering, Industrial & Manufacturing Engineering"
Jurnal Energi Dan Manufaktur,"Energy, Industrial & Manufacturing Engineering"
Jurnal Rekayasa Sistem Industri,Industrial & Manufacturing Engineering
JURNAL KONVERSI,"Biochemistry, Genetics & Molecular Biology, Chemical Engineering, Chemistry & Bioengineering, Chemistry, Engineering, Industrial & Manufacturing Engineering"
Jurnal Agroindustri,"Agriculture, Biological Sciences & Forestry, Electrical & Electronics Engineering, Energy, Industrial & Manufacturing Engineering"
Journal of Industrial Engineering,Industrial & Manufacturing Engineering
JURNAL REKAYASA SISTEM INDUSTRI,"Computer Science & IT, Economics, Econometrics & Finance, Industrial & Manufacturing Engineering, Materials Science & Nanotechnology"
Jurnal Teknologi,"Computer Science & IT, Electrical & Electronics Engineering, Industrial & Manufacturing Engineering, Mechanical Engineering"
Teknobiz : Jurnal Ilmiah Program Studi Magister Teknik Mesin,"Automotive Engineering, Energy, Engineering, Industrial & Manufacturing Engineering, Materials Science & Nanotechnology"
Reka Buana : Jurnal Ilmiah Teknik Sipil dan Teknik Kimia,"Chemical Engineering, Chemistry & Bioengineering, Civil Engineering, Building, Construction & Architecture, Engineering, Environmental Science, Industrial & Manufacturing Engineering"
Journal of Green Science and Technology,"Chemical Engineering, Chemistry & Bioengineering, Civil Engineering, Building, Construction & Architecture, Electrical & Electronics Engineering, Engineering, Industrial & Manufacturing Engineering"
Jurnal Teknik Sipil dan Teknologi Konstruksi,"Civil Engineering, Building, Construction & Architecture, Engineering, Industrial & Manufacturing Engineering, Mechanical Engineering, Transportation"
J-ENSITEC,"Civil Engineering, Building, Construction & Architecture, Computer Science & IT, Industrial & Manufacturing Engineering, Mechanical Engineering"
Jurnal Teknovasi : Jurnal Teknik dan Inovasi,"Aerospace Engineering, Agriculture, Biological Sciences & Forestry, Computer Science & IT, Engineering, Industrial & Manufacturing Engineering, Materials Science & Nanotechnology"
Jurnal Manajemen Dirgantara,"Decision Sciences, Operations Research & Management , Education, Industrial & Manufacturing Engineering, Transportation"
Jurnal Tekno,"Civil Engineering, Building, Construction & Architecture, Electrical & Electronics Engineering, Industrial & Manufacturing Engineering"
INAQUE: Journal of Industrial & Quality Engineering,"Computer Science & IT, Economics, Econometrics & Finance, Engineering, Industrial & Manufacturing Engineering, Mechanical Engineering"
Agroindustrial Technology Journal,"Agriculture, Biological Sciences & Forestry, Industrial & Manufacturing Engineering"
PSYCHOPEDIA : Jurnal Psikologi Universitas Buana Perjuangan Karawang,"Humanities, Decision Sciences, Operations Research & Management , Industrial & Manufacturing Engineering, Physics, Social Sciences"
Journal of Degraded and Mining Lands Management,"Agriculture, Biological Sciences & Forestry, Biochemistry, Genetics & Molecular Biology"
Indonesian Journal of Chemistry,"Chemical Engineering, Chemistry & Bioengineering, Chemistry"
Indonesian Journal of Biotechnology,"Biochemistry, Genetics & Molecular Biology, Immunology & microbiology, Materials Science & Nanotechnology"
Bulletin of Chemical Reaction Engineering & Catalysis,"Chemical Engineering, Chemistry & Bioengineering, Chemistry"
The Indonesian Biomedical Journal,"Biochemistry, Genetics & Molecular Biology, Public Health"
Indonesian Aquaculture Journal,"Agriculture, Biological Sciences & Forestry, Biochemistry, Genetics & Molecular Biology"
Molekul: Jurnal Ilmiah Kimia,"Chemical Engineering, Chemistry & Bioengineering, Chemistry"
Squalen Bulletin of Marine and Fisheries Postharvest and Biotechnology,"Agriculture, Biological Sciences & Forestry, Biochemistry, Genetics & Molecular Biology, Environmental Science, Immunology & microbiology"
BERITA BIOLOGI,"Agriculture, Biological Sciences & Forestry, Biochemistry, Genetics & Molecular Biology"
Buletin Plasma Nutfah,"Biochemistry, Genetics & Molecular Biology"
Jurnal Pascapanen dan Bioteknologi Kelautan dan Perikanan,"Agriculture, Biological Sciences & Forestry, Biochemistry, Genetics & Molecular Biology, Environmental Science"
Scientific Dental Journal,"Biochemistry, Genetics & Molecular Biology, Dentistry, Education, Health Professions, Immunology & microbiology"
Jurnal Penelitian Perikanan Indonesia,"Agriculture, Biological Sciences & Forestry, Biochemistry, Genetics & Molecular Biology"
The Journal of Pure and Applied Chemistry Research,Chemistry
LIMNOTEK - Perairan Darat Tropis di Indonesia,"Biochemistry, Genetics & Molecular Biology, Chemical Engineering, Chemistry & Bioengineering, Environmental Science"
Jurnal Riset Akuakultur,"Agriculture, Biological Sciences & Forestry, Biochemistry, Genetics & Molecular Biology"
Indonesian Journal of Cancer Chemoprevention,"Biochemistry, Genetics & Molecular Biology, Medicine & Pharmacology"
MAKARA of Science Series,"Biochemistry, Genetics & Molecular Biology, Chemistry, Earth & Planetary Sciences, Materials Science & Nanotechnology, Physics"
Jurnal Sylva Lestari,"Agriculture, Biological Sciences & Forestry, Biochemistry, Genetics & Molecular Biology, Economics, Econometrics & Finance"
Oseanologi dan Limnologi di Indonesia,"Biochemistry, Genetics & Molecular Biology, Earth & Planetary Sciences, Environmental Science"
Indonesian Fisheries Research Journal,"Agriculture, Biological Sciences & Forestry, Biochemistry, Genetics & Molecular Biology"
Jurnal Tanaman Industri dan Penyegar,"Agriculture, Biological Sciences & Forestry, Biochemistry, Genetics & Molecular Biology, Industrial & Manufacturing Engineering"
Jurnal Tadris Kimiya,"Chemistry, Education"
BAWAL Widya Riset Perikanan Tangkap,"Agriculture, Biological Sciences & Forestry, Biochemistry, Genetics & Molecular Biology"
VALENSI,Chemistry
Jurnal Bioteknologi & Biosains Indonesia (JBBI),"Agriculture, Biological Sciences & Forestry, Biochemistry, Genetics & Molecular Biology, Immunology & microbiology"
Industria: Jurnal Teknologi dan Manajemen Agroindustri,"Agriculture, Biological Sciences & Forestry, Biochemistry, Genetics & Molecular Biology, Chemical Engineering, Chemistry & Bioengineering, Control & Systems Engineering, Decision Sciences, Operations Research & Management , Economics, Econometrics & Finance, Engineering, Environmental Science, Industrial & Manufacturing Engineering, Materials Science & Nanotechnology, Medicine & Pharmacology, Other"
ASEAN Journal on Science and Technology for Development,"Biochemistry, Genetics & Molecular Biology, Chemical Engineering, Chemistry & Bioengineering, Computer Science & IT, Mathematics"
Alchemy Jurnal Penelitian Kimia,"Chemical Engineering, Chemistry & Bioengineering, Energy, Environmental Science, Materials Science & Nanotechnology"
Jurnal Biodjati,"Biochemistry, Genetics & Molecular Biology, Earth & Planetary Sciences"
Journal of Tropical Biodiversity and Biotechnology,"Agriculture, Biological Sciences & Forestry, Biochemistry, Genetics & Molecular Biology, Environmental Science, Immunology & microbiology"
Media Akuakultur,"Agriculture, Biological Sciences & Forestry, Biochemistry, Genetics & Molecular Biology"
Omni-Akuatika,"Agriculture, Biological Sciences & Forestry, Biochemistry, Genetics & Molecular Biology, Environmental Science"
Jurnal Teknologi Mineral dan Batubara,"Chemical Engineering, Chemistry & Bioengineering, Energy"
Medical Laboratory Technology Journal,"Chemistry, Health Professions, Immunology & microbiology, Medicine & Pharmacology, Public Health"
Journal of Biomedicine and Translational Research,"Biochemistry, Genetics & Molecular Biology, Medicine & Pharmacology"
JURNAL PERBENIHAN TANAMAN HUTAN,"Agriculture, Biological Sciences & Forestry, Biochemistry, Genetics & Molecular Biology, Earth & Planetary Sciences"
Jurnal Sains Farmasi & Klinis,"Biochemistry, Genetics & Molecular Biology, Health Professions, Immunology & microbiology, Medicine & Pharmacology, Public Health"
JURNAL KIMIA SAINS DAN APLIKASI,"Chemical Engineering, Chemistry & Bioengineering, Chemistry, Engineering"
Jurnal Aplikasi Teknologi Pangan,"Agriculture, Biological Sciences & Forestry, Chemical Engineering, Chemistry & Bioengineering, Chemistry, Immunology & microbiology, Other"
Jurnal Teknologi Laboratorium,"Chemistry, Other"
Elkawnie,"Biochemistry, Genetics & Molecular Biology, Education, Engineering"
Jurnal Riset Industri Hasil Hutan,"Agriculture, Biological Sciences & Forestry, Chemical Engineering, Chemistry & Bioengineering, Chemistry, Industrial & Manufacturing Engineering, Materials Science & Nanotechnology"
AGROSAINSTEK: Jurnal Ilmu dan Teknologi Pertanian,"Agriculture, Biological Sciences & Forestry, Biochemistry, Genetics & Molecular Biology, Environmental Science"
JKPK (Jurnal Kimia dan Pendidikan Kimia),"Chemical Engineering, Chemistry & Bioengineering, Chemistry"
Jurnal Entomologi Indonesia,"Agriculture, Biological Sciences & Forestry, Biochemistry, Genetics & Molecular Biology"
Jurnal Perikanan Universitas Gadjah Mada,"Agriculture, Biological Sciences & Forestry, Biochemistry, Genetics & Molecular Biology, Immunology & microbiology"
JKKI : Jurnal Kedokteran dan Kesehatan Indonesia,"Biochemistry, Genetics & Molecular Biology, Immunology & microbiology, Medicine & Pharmacology, Public Health"
Majalah Ilmiah Pengkajian Industri,"Aerospace Engineering, Chemical Engineering, Chemistry & Bioengineering, Engineering, Industrial & Manufacturing Engineering, Transportation"
Agrointek,"Agriculture, Biological Sciences & Forestry, Biochemistry, Genetics & Molecular Biology"
ANNALES BOGORIENSES,"Agriculture, Biological Sciences & Forestry, Biochemistry, Genetics & Molecular Biology, Chemical Engineering, Chemistry & Bioengineering, Chemistry, Immunology & microbiology, Medicine & Pharmacology"
Jurnal Kimia dan Kemasan,Chemistry
Padjadjaran Journal of Dentistry,"Biochemistry, Genetics & Molecular Biology, Dentistry, Health Professions, Immunology & microbiology, Medicine & Pharmacology, Public Health"
Jurnal Industri Hasil Perkebunan,"Agriculture, Biological Sciences & Forestry, Chemical Engineering, Chemistry & Bioengineering, Environmental Science, Industrial & Manufacturing Engineering"
Floribunda,"Agriculture, Biological Sciences & Forestry, Biochemistry, Genetics & Molecular Biology"
BIOEDUSCIENCE,"Agriculture, Biological Sciences & Forestry, Biochemistry, Genetics & Molecular Biology, Education"
Jurnal Farmasi Galenika (Galenika Journal of Pharmacy),"Biochemistry, Genetics & Molecular Biology, Chemistry, Health Professions, Immunology & microbiology, Medicine & Pharmacology"
Indonesian Journal of Fundamental and Applied Chemistry,"Biochemistry, Genetics & Molecular Biology, Chemistry, Environmental Science"
Majalah Ilmiah Biologi BIOSFERA: A Scientific Journal,"Agriculture, Biological Sciences & Forestry, Biochemistry, Genetics & Molecular Biology, Environmental Science"
Jurnal Penelitian Pendidikan IPA,"Agriculture, Biological Sciences & Forestry, Biochemistry, Genetics & Molecular Biology, Chemical Engineering, Chemistry & Bioengineering, Chemistry, Education, Materials Science & Nanotechnology, Physics"
Jurnal Ilmu Peternakan dan Veteriner Tropis (JIPVET),"Agriculture, Biological Sciences & Forestry, Biochemistry, Genetics & Molecular Biology, Economics, Econometrics & Finance, Veterinary"
Jurnal Katalisator,"Biochemistry, Genetics & Molecular Biology, Chemical Engineering, Chemistry & Bioengineering"
Journal of Natural Science and Integration,"Biochemistry, Genetics & Molecular Biology, Chemical Engineering, Chemistry & Bioengineering, Education"
EduChemia (Jurnal Kimia dan Pendidikan),"Chemical Engineering, Chemistry & Bioengineering, Chemistry, Education"
Jurnal Fitofarmaka Indonesia,"Biochemistry, Genetics & Molecular Biology, Chemistry, Medicine & Pharmacology"
Indonesian Journal of Chemical Research,"Agriculture, Biological Sciences & Forestry, Biochemistry, Genetics & Molecular Biology, Chemical Engineering, Chemistry & Bioengineering, Chemistry, Environmental Science"
Jurnal Akademika Kimia,"Chemistry, Education"
Journal of Chemistry,"Biochemistry, Genetics & Molecular Biology, Chemical Engineering, Chemistry & Bioengineering, Chemistry, Environmental Science, Materials Science & Nanotechnology"
Indonesian Journal of Science and Education,"Chemistry, Education, Environmental Science, Physics"
Molecular and Cellular Biomedical Sciences,"Biochemistry, Genetics & Molecular Biology, Dentistry, Immunology & microbiology, Medicine & Pharmacology, Neuroscience"
Journal of Chemical Process Engineering,"Chemical Engineering, Chemistry & Bioengineering, Chemistry, Energy, Engineering, Environmental Science"
Media Farmasi: Jurnal Ilmu Farmasi,"Chemistry, Immunology & microbiology, Materials Science & Nanotechnology, Medicine & Pharmacology"
al-Kimiya,Chemistry
Biota,"Agriculture, Biological Sciences & Forestry, Biochemistry, Genetics & Molecular Biology, Education, Environmental Science, Medicine & Pharmacology"
Sainmatika: Jurnal Ilmiah Matematika dan Ilmu Pengetahuan Alam,"Agriculture, Biological Sciences & Forestry, Chemistry, Mathematics, Physics"
Jurnal Ilmu Produksi dan Teknologi Hasil Peternakan,"Agriculture, Biological Sciences & Forestry, Biochemistry, Genetics & Molecular Biology, Veterinary"
Scripta Biologica,"Agriculture, Biological Sciences & Forestry, Biochemistry, Genetics & Molecular Biology"
Jurnal Teknik Kimia dan Lingkungan,"Chemical Engineering, Chemistry & Bioengineering, Energy, Engineering, Environmental Science, Materials Science & Nanotechnology"
Jurnal Arsitektur ARCADE,"Chemical Engineering, Chemistry & Bioengineering, Civil Engineering, Building, Construction & Architecture"
"BIOLINK (Jurnal Biologi Lingkungan, Industri, Kesehatan)","Agriculture, Biological Sciences & Forestry, Biochemistry, Genetics & Molecular Biology"
Biomedika,"Biochemistry, Genetics & Molecular Biology, Medicine & Pharmacology"
Journal of Tropical Pharmacy and Chemistry,"Agriculture, Biological Sciences & Forestry, Biochemistry, Genetics & Molecular Biology, Chemical Engineering, Chemistry & Bioengineering, Medicine & Pharmacology, Public Health"
Jurnal Farmasi Indonesia,"Biochemistry, Genetics & Molecular Biology, Chemical Engineering, Chemistry & Bioengineering, Immunology & microbiology, Medicine & Pharmacology"
Jukung (Jurnal Teknik Lingkungan),"Agriculture, Biological Sciences & Forestry, Chemistry, Civil Engineering, Building, Construction & Architecture, Engineering, Environmental Science"
Jurnal Farmasi Sains dan Praktis,"Biochemistry, Genetics & Molecular Biology, Health Professions, Immunology & microbiology, Materials Science & Nanotechnology, Medicine & Pharmacology"
Journal of Biology Education,"Biochemistry, Genetics & Molecular Biology, Education"
Jurnal Pendidikan Sains | Pendidikan Kimia,"Chemistry, Education"
Jurnal ILMU DASAR,"Biochemistry, Genetics & Molecular Biology, Chemistry, Mathematics, Physics"
Jurnal Inovasi Pendidikan Kimia,"Chemical Engineering, Chemistry & Bioengineering, Chemistry, Education"
Jurnal Biologi Udayana,"Agriculture, Biological Sciences & Forestry, Biochemistry, Genetics & Molecular Biology"
Kartika Jurnal Ilmiah Farmasi,"Biochemistry, Genetics & Molecular Biology, Health Professions, Immunology & microbiology, Medicine & Pharmacology"
Jurnal Kimia Terapan Indonesia,"Biochemistry, Genetics & Molecular Biology, Chemical Engineering, Chemistry & Bioengineering, Chemistry, Materials Science & Nanotechnology"
Al-Kimia,Chemistry
Phenomenon : Jurnal Pendidikan MIPA,"Chemistry, Education, Mathematics, Physics"
JRST (Jurnal Riset Sains dan Teknologi),"Chemical Engineering, Chemistry & Bioengineering, Chemistry, Civil Engineering, Building, Construction & Architecture, Computer Science & IT, Engineering"
Jurnal Kimia Riset,Chemistry
JFMR-Journal of Fisheries and Marine Research,"Agriculture, Biological Sciences & Forestry, Biochemistry, Genetics & Molecular Biology, Engineering, Environmental Science"
Journal of Research and Technology,"Chemical Engineering, Chemistry & Bioengineering, Engineering, Environmental Science, Industrial & Manufacturing Engineering"
Jurnal Penelitian Kehutanan FALOAK,"Agriculture, Biological Sciences & Forestry, Biochemistry, Genetics & Molecular Biology, Economics, Econometrics & Finance, Environmental Science, Immunology & microbiology"
JURNAL BIOLOGI INDONESIA,"Biochemistry, Genetics & Molecular Biology"
Majalah Patologi Indonesia,"Biochemistry, Genetics & Molecular Biology, Materials Science & Nanotechnology, Medicine & Pharmacology"
Multitek Indonesia : Jurnal Ilmiah,"Chemical Engineering, Chemistry & Bioengineering, Chemistry, Civil Engineering, Building, Construction & Architecture, Computer Science & IT, Control & Systems Engineering"
EKSAKTA: Berkala Ilmiah Bidang MIPA,"Agriculture, Biological Sciences & Forestry, Biochemistry, Genetics & Molecular Biology, Chemical Engineering, Chemistry & Bioengineering, Mathematics, Physics"
CHEMICA Jurnal Teknik Kimia,"Chemical Engineering, Chemistry & Bioengineering, Energy"
Bioedukasi: Jurnal Pendidikan Biologi,"Agriculture, Biological Sciences & Forestry, Biochemistry, Genetics & Molecular Biology, Education, Immunology & microbiology"
Edumatsains,"Agriculture, Biological Sciences & Forestry, Chemistry, Education, Mathematics, Physics"
Jurnal Zarah,"Chemistry, Education"
Biota Jurnal Ilmiah Ilmu-Ilmu Hayati,"Agriculture, Biological Sciences & Forestry, Biochemistry, Genetics & Molecular Biology"
Jurnal Biotek,"Agriculture, Biological Sciences & Forestry, Biochemistry, Genetics & Molecular Biology, Education"
Jurnal Biologi Tropis,"Agriculture, Biological Sciences & Forestry, Biochemistry, Genetics & Molecular Biology, Immunology & microbiology"
Biosel: Biologi Science and Education,"Agriculture, Biological Sciences & Forestry, Biochemistry, Genetics & Molecular Biology, Education, Energy, Environmental Science"
JURNAL PIJAR,"Chemistry, Education, Mathematics, Physics"
JURNAL AGROINDUSTRI HALAL,"Chemical Engineering, Chemistry & Bioengineering, Environmental Science, Other"
Jurnal Pendidikan Kimia (JPKim),"Biochemistry, Genetics & Molecular Biology, Chemistry, Education, Environmental Science"
LENSA (Lentera Sains): Jurnal Pendidikan IPA,"Chemistry, Education, Physics"
JRPK: Jurnal Riset Pendidikan Kimia,"Chemical Engineering, Chemistry & Bioengineering, Chemistry, Education"
Jurnal Biologi Universitas Andalas,"Agriculture, Biological Sciences & Forestry, Biochemistry, Genetics & Molecular Biology"
Quantum,"Agriculture, Biological Sciences & Forestry, Chemistry, Physics"
PENA SAINS,"Agriculture, Biological Sciences & Forestry, Chemistry, Mathematics, Physics"
Jurnal Airaha,"Agriculture, Biological Sciences & Forestry, Biochemistry, Genetics & Molecular Biology, Chemistry, Electrical & Electronics Engineering"
MPI (Media Pharmaceutica Indonesiana),"Chemistry, Health Professions, Immunology & microbiology, Materials Science & Nanotechnology, Medicine & Pharmacology"
Journal of Issues in Midwifery,"Biochemistry, Genetics & Molecular Biology, Health Professions, Medicine & Pharmacology, Nursing, Public Health"
